col1,col2,col3,col4,col5,col6,col7,col8,sort_date
03294-2024,11/01/24 12:01 AM,10/31/24 10:35 PM,Liquor Law Violation,Third North Residence Hall,Washington Square,A student reported a Liquor Law Violation. x3,Closed/ Referred to Office of Student Conduct & Community Standards,2024-11-01
03307-2024,11/01/24 03:18 PM,10/28/24 01:55 PM,Harassment,Silver Building,Washington Square,A student reported Harassment.,Closed/ Referred to Office of Student Conduct & Community Standards,2024-11-01
03317-2024,11/01/24 05:39 PM,11/01/24 05:39 PM,Liquor Law Violation,Coral Towers Residence Hall,Washington Square,An RA reported illegal alcohol possession. (x5),Closed/ Referred to Office of Student Conduct & Community Standards,2024-11-01
03296-2024,11/01/24 12:30 AM,11/01/24 12:06 AM,Liquor Law Violation,Third North Residence,Washington Square,A student reported a Liquor Law Violation. x5,Closed/ Referred to Office of Student Conduct & Community Standards,2024-11-01
2024-3049,11/01/24 02:00 PM,11/01/24 01:42 PM - 11/01/24 02:25 PM,"Stalking, Dating Violence, Simple Assault",Furman Hall,Washington Square,"A student reported stalking, dating violence, and simple assault.",Closed/ Referred to NYPD,2024-11-01
2024-3052,11/01/24 04:44 PM,11/01/24 03:45 PM - 11/01/24 04:40 PM,Larceny,Paulson Center,Washington Square,A student reported missing property.,Closed,2024-11-01
2024-3044,11/01/24 11:45 AM,10/30/24 01:32 PM - 10/30/24 01:38 PM,Criminal Trespass,Midtown Center,Midtown Center,A Security Officer reported a Criminal Trespass.,Closed,2024-11-01
2024-3050,11/01/24 02:32 PM,11/01/24 11:00 AM - 11/01/24 02:32 PM,Larceny,6 MetroTech Center,Brooklyn Commons,A student reported missing property.,Closed/ Referred to NYPD,2024-11-01
03334-2024,11/02/24 02:07 AM,11/02/24 12:06 AM,Liquor Law Violation,Lafayette Hall,Washington Square,An RA reported illegal alcohol possession. (x5),Closed/ Referred to Office of Student Conduct & Community Standards,2024-11-02
03340-2024,11/02/24 12:48 AM,11/01/24 04:12 PM,Liquor Law Violation,Coral Tower Residence Hall,Washington Square,An RA reported illegal alcohol possession.,Closed/ Referred to Office of Student Conduct & Community Standards,2024-11-02
03344-2024,11/02/24 04:32 AM,11/01/24 03:26 PM,Liquor Law Violation,Coral Tower Residence Hall,Washington Square,An RA reported illegal alcohol possession. (x2),Closed/ Referred to Office of Student Conduct & Community Standards,2024-11-02
03346-2024,11/02/24 05:20 AM,11/01/24 03:51 PM,Liquor Law Violation,Coral Tower Residence Hall,Washington Square,An RA reported illegal alcohol possession. (x2),Closed/ Referred to Office of Student Conduct & Community Standards,2024-11-02
2024-3064,11/03/24 02:07 AM,11/03/24 02:00 AM - 11/03/24 03:00 AM,Harassment,20 Cooper Square,Washington Square,A Campus Safety Officer reported Harassment.,Open,2024-11-03
03355-2024,11/03/24 03:24 PM,11/03/24 02:40 AM,Liquor Law Violation,Weinstein Residence Hall,Washington Square,An RA reported illegal alcohol possession.,Closed/ Referred to Office of Student Conduct & Community Standards,2024-11-03
03358-2024,11/03/24 08:55 AM,11/02/24 05:54 PM,Liquor Law Violation,Weinstein Residence Hall,Washington Square,An RA reported illegal alcohol possession. (x2),Closed/ Referred to Office of Student Conduct & Community Standards,2024-11-03
03367-2024,11/03/24 06:35 PM,11/03/24 04:09 PM,Liquor Law Violation,Lafayette Hall,Washington Square,An RA reported illegal alcohol possession. (x2),Closed/ Referred to Office of Student Conduct & Community Standards,2024-11-03
2024-3080,11/04/24 01:50 PM,11/04/24 12:30 PM - 11/04/24 01:30 PM,Larceny,Bobst Library,Washington Square,A student reported missing property.,Closed,2024-11-04
2024-3074,11/04/24 08:38 AM,11/01/24 10:30 AM - 11/01/24 10:53 AM,Harassment,Palladium Residence Hall,Washington Square,A student reported Harassment.,Closed,2024-11-04
2024-3091,11/05/24 10:53 AM,10/26/24 11:00 PM - 10/27/24,Larceny,Third North Residence Hall,Washington Square,A student reported missing property.,Open,2024-11-05
00505-2025,11-05-2024,11-29-2024 9:00 PM,Sexual Abuse / Dating Violence,Palladium Hall,Washington Square,A student reported sexual abuse and dating violence.,Closed/ Referred to Office of Student Conduct & Community Standards,2024-11-05
2024-3112,11/06/24 10:34 AM,11/06/24 09:22 AM,Fondling,Education Building - Exterior,Washington Square,A student reported a Fondling.,Closed/ Referred to NYPD,2024-11-06
2024-3126,11/06/24 10:30 PM,11/06/24 09:30 PM - 11/06/24 10:30 PM,Harassment,Kimmel Center,Washington Square,A student reported Harassment.,Closed,2024-11-06
2024-3124,11/06/24 07:30 PM,11/06/24 07:20 PM,Harassment,Washington Place between 6th Avenue and Washington Square West,Washington Square,A student reported a Harassment.,Closed,2024-11-06
2024-3119,11/06/24 03:06 PM,10/30/24 03:20 PM - 11/06/24 05:10 PM,Stalking,Bobst Library,Washington Square,A student reported a Stalking.,Open,2024-11-06
2024-3121,11/06/24 05:49 PM,11/06/24 04:40 PM - 11/06/24 04:42 PM,Found Property (reclassified from Larceny on 11.7),Paulson Center,Washington Square,A student reported missing property.,Closed,2024-11-06
2024-3116,11/06/24 01:11 PM,11/05/24 10:55 PM - 11/05/24 10:58 PM,Larceny,Kimmel Center,Washington Square,A student reported missing property.,Open,2024-11-06
2024-3109,11/06/24 09:42 AM,11/06/24 09:17 AM - 11/06/24 10:02 AM,Criminal Trespass,Rogers Hall,Washington Square,A Campus Safety Officer reported a Criminal Trespass.,Open,2024-11-06
2024-3118,11/06/24 02:09 PM,11/06/24 02:04 PM - 11/06/24 03:49 PM,Disorderly Conduct / Harassment,Weissman Hall,Kips Bay,A staff member reported Disorderly Conduct and Harassment.,Open,2024-11-06
2024-3135,11/07/24 07:36 PM,11/07/24 07:35 PM - 11/07/24 07:37 PM,Loitering,Carlyle Court,Washington Square,A Campus Safety Officer reported Loitering.,Closed/ Referred to NYPD,2024-11-07
2024-3137,11/07/24 10:05 PM,11/05/24 03:11 PM - 11/05/24 07:00 PM,Larceny,Rubin Residence Hall,Washington Square,A student reported missing property.,Open,2024-11-07
03420-2024,11/07/24 07:17 PM,11/07/24 06:07 PM,Liquor Law Violation,Third Avenue North Residence Hall,Washington Square,An RA reported a Liquor Law Violation. (x2),Open,2024-11-07
2024-3140,11/07/24 09:43 AM,11/05/24 - 11/05/24,Criminal Trespass,19 University Place,Washington Square,A staff member reported a Criminal Trespass.,Closed,2024-11-07
2024-3144,11/08/24 12:47 AM,11/07/24 11:30 PM,Aggravated Assault,11 Waverly Place - Exterior,Washington Square,An individual reported am Aggravated Assault.,Closed/ Referred to NYPD,2024-11-08
2024-3161,11/10/24 03:08 AM,11/10/24 01:20 AM,Arson,Third North Residence - Exterior,Washington Square,A campus safety officer reported an Arson.,Open,2024-11-10
2024-3165,11/10/24 05:32 PM,11/10/24,Harassment,Rogers Hall - Exterior,Brooklyn Commons,A student reported Harassment.,Open,2024-11-10
03462-2024,11/10/24 11:29 AM,11/10/24 10:28 AM,Liquor Law Violation,Third North Residence Hall,Washington Square,A student reported a Liquor Law Violation. x5,Closed/ Referred to Office of Student Conduct & Community Standards,2024-11-10
03467-2024,11/10/24 04:22 PM,11/10/24 03:00 PM,Liquor Law Violation,Broome Street Residence,Washington Square,A student reported a Liquor Law Violation. x2,Closed/ Referred to Office of Student Conduct & Community Standards,2024-11-10
2024-3187,11/11/24 08:36 PM,11/11/24 05:30 PM - 11/11/24 08:30 PM,Larceny,Rogers Hall - Exterior,Brooklyn Commons,A student reported a Larceny.,Open,2024-11-11
03474-2024,11/11/24 11:51 AM,11/11/24 11:18 AM,Criminal Mischief,Lafayette Residence Hall,Washington Square,A student reported Criminal Mischief.,Open,2024-11-11
2024-3173,11/11/24 11:00 AM,11/09/24 03:00 PM - 11/09/24 03:20 PM,Larceny,Bobst Library,Washington Square,A student reported a Larceny.,Closed/ Referred to NYPD,2024-11-11
2024-3177,11/11/24 03:36 PM,11/11/24 03:00 PM,Larceny / Embezzlement / Harassment,Weinstein Residence Hall - Exterior,Washington Square,A student reported Larceny / Embezzlement / Harassment.,Closed/ Referred to NYPD,2024-11-11
2024-3178,11/11/24 03:58 PM,11/11/24 02:30 PM,Larceny / Embezzlement,Washington Square South,Washington Square,A student reported a Larceny / Embezzlement.,Closed,2024-11-11
2024-3181,11/11/24 05:54 PM,11/11/24 03:45 PM - 11/11/24 04:45 PM,Larceny,Palladium Residence Hall,Washington Square,A student reported a Larceny.,Closed,2024-11-11
2024-3182,11/11/24 05:59 PM,11/11/24 03:23 PM,Larceny / Embezzlement,Warren Weaver Hall - Exterior,Washington Square,A student reported a Larceny / Embezzlement.,Closed/ Referred to NYPD,2024-11-11
2024-3183,11/11/24 06:45 PM,11/11/24 04:30 PM - 11/11/24 06:30 PM,Larceny,Palladium Residence Hall,Washington Square,A student reported a Larceny.,Closed,2024-11-11
2024-3188,11/11/24 08:35 PM,10/06/24 08:39 PM - 10/26/24 05:28 PM,Larceny,Palladium Residence Hall,Washington Square,A student reported a Larceny.,Open,2024-11-11
2024-3200,11/12/24 11:25 AM,11/13/24 10:26 AM,Fondling,Schwartz Hall,Kips Bay,A staff member reported a Fondling.,Closed/ Referred to NYPD,2024-11-12
2024-3195,11/12/24 04:40 PM,10/31/24 01:00 PM - 10/31/24 01:45 PM,Larceny,Kaufman Management Center,Washington Square,A student reported a Larceny.,Closed,2024-11-12
2024-3193,11/12/24 01:20 PM,11/12/24 12:40 PM - 11/12/24 01:15 PM,Larceny,Bobst Library,Washington Square,An individual reported a Larceny.,Closed/ Referred to NYPD,2024-11-12
2024-3192,11/12/24 11:08 AM,11/12/24 10:27 AM,Larceny,Paulson Center - Exterior,Washington Square,A staff member reported a Larceny.,Open,2024-11-12
2024-3194,11/12/24 03:23 PM,11/13/24 03:22 PM,Harassment and Larceny,Rubin Hall - Exterior,Washington Square,A student reported harassment and a larceny.,Closed/ Referred to NYPD,2024-11-12
03530-2024,11/13/24 10:26 PM,11/13/24 06:20 PM,Liquor Law Violation,Broome Street Residence,Washington Square,A student reported a Liquor Law Violation.,Closed/ Referred to Office of Student Conduct & Community Standards,2024-11-13
2024-3208,11/13/24 05:19 PM,11/13/24 12:30 PM - 11/13/24 05:09 PM,Motor Vehicle Theft,Schwartz Hall - Exterior,Kips Bay & Langone,A student reported a Motor Vehicle Theft.,Closed/ Referred to NYPD,2024-11-13
2024-3202,11/13/24 11:47 AM,11/13/24 10:55 AM,Fondling,Washington Square North & Fifth Avenue,Washington Square,A student reported a Fondling.,Open,2024-11-13
2024-3203,11/13/24 12:33 PM,11/13/24 07:50 AM - 11/13/24 09:04 AM,Motor Vehicle Theft,370 Jay Street - Exterior,Brooklyn Commons,A staff member reported a Motor Vehicle Theft.,Closed/ Referred to NYPD,2024-11-13
2024-3206,11/13/24 03:06 PM,11/13/24 02:34 PM - 11/13/24 03:20 PM,Criminal Mischief,Kevorkian Center,Washington Square,A campus safety officer reported Criminal Mischief.,Closed/ Referred to NYPD,2024-11-13
2024-3207,11/13/24 03:08 PM,11/11/24 06:00 PM - 11/12/24 10:00 AM,Larceny,726 Broadway,Washington Square,A student reported a Larceny.,Closed,2024-11-13
2024-3214,11/13/24 09:00 PM,11/13/24 06:31 PM - 11/13/24 08:06 PM,Larceny,404 Lafayette,Washington Square,A student reported a Larceny.,Closed,2024-11-13
03512-2024,11/13/24 05:09 PM,11/13/24 04:02 PM,Liquor Law Violation,Othmer Residence Hall,Brooklyn Commons,A student reported a Liquor Law Violation.,Closed/ Referred to Office of Student Conduct & Community Standards,2024-11-13
03518-2024,11/13/24 06:27 PM,11/12/24 11:45 PM,Harassment,Lafayette Residence Hall,Washington Square,A student reported Harassment.,Open,2024-11-13
03524-2024,11/13/24 08:49 PM,11/13/24 08:05 PM,Liquor Law Violation,Brittany Hall Residence,Washington Square,A student reported a Liquor Law Violation. x4,Closed/ Referred to Office of Student Conduct & Community Standards,2024-11-13
03529-2024,11/13/24 10:14 PM,11/13/24 06:05 PM,Liquor Law Violation,Broome Street Residence,Washington Square,A student reported a Liquor Law Violation. x2,Closed/ Referred to Office of Student Conduct & Community Standards,2024-11-13
03502-2024,11/13/24 12:53 PM,11/06/24 10:14 PM,Liquor Law Violation,Clark Street Residence,Brooklyn Commons,A student reported a Liquor Law Violation. x3,Closed/ Referred to Office of Student Conduct & Community Standards,2024-11-13
03548-2024,11/14/24 08:30 PM,11/14/24 12:00 AM,Harassment,1 University Place - Exterior,Washington Square,A student reported Harassment.,Closed,2024-11-14
2024-3222,11/14/24 09:40 AM,11/13/24 07:30 PM - 11/13/24 08:25 PM,Larceny,Tisch Hall,Washington Square,A student reported a larceny.,Closed,2024-11-14
03538-2024,11/14/24 02:24 PM,11/14/24 12:30 PM,Liquor Law Violation,Broome Street Residence Hall,Washington Square,A staff member reported a liquor law violation. (4x),Closed/ Referred to Office of Student Conduct & Community Standards,2024-11-14
2024-3219,11/14/24 01:55 PM,10/10/24 07:00 PM - 10/10/24,Larceny,Dibner Library - Exterior,Brooklyn Commons,A staff member reported a Larceny.,Open,2024-11-14
2024-3219,11/15/24 01:55 PM,10/31/24 07:00 PM - 10/31/24,Motor Vehicle Theft,Dibner Library - Exterior,Brooklyn Commons,A staff member reported a Motor Vehicle Theft.,Closed/ Referred to NYPD,2024-11-15
03569-2024,11/15/24 11:39 PM,11/15/24 10:38 PM,Liquor Law Violation,Lipton Hall,Washington Square,An RA reported Liquor Law Violation. (x18),Closed/ Referred to Office of Student Conduct & Community Standards,2024-11-15
2024-3237,11/15/24 06:00 PM,11/15/24 05:45 PM,Robbery,Washington Square Park,Washington Square,A student reported a Robbery.,Closed/ Referred to NYPD,2024-11-15
03554-2024,11/15/24 12:51 AM,11/14/24 10:30 PM - 11/14/24 10:50 PM,Liquor Law Violation,Brittany Hall,Washington Square,An RA reported Liquor Law Violation (x7).,Closed/ Referred to Office of Student Conduct & Community Standards,2024-11-15
2024-3235,11/15/24 05:10 PM,11/12/24 12:00 AM - 11/12/24 10:30 AM,Larceny,Othmer Hall,Brooklyn Commons,A student reported stolen property.,Open,2024-11-15
03564-2024,11/15/24 08:58 PM,11/15/24 06:00 PM,Liquor Law Violation,Gramercy Green Residence Hall,Washington Square,An RA reported a Liquor Law Violation. (x2),Closed/ Referred to Office of Student Conduct & Community Standards,2024-11-15
2024-3247,11/16/24 09:12 AM,11/16/24 09:08 AM,Criminal Mischief,370 Jay Street - Exterior,Brooklyn Commons,A Campus Safety Officer reported graffiti.,Closed/ Referred to NYPD,2024-11-16
2024-3252,11/16/24 02:48 PM,11/16/24 02:45 PM,Harassment,Waverly Place and University Place,Washington Square,A student reported Harassment.,Open,2024-11-16
03576-2024,11/16/24 02:26 PM,11/15/24 08:42 PM,Liquor Law Violation,Rubin Hall,Washington Square,An RA reported a Liquor Law Violation. (x2),Closed/ Referred to Office of Student Conduct & Community Standards,2024-11-16
2024-3256,11/17/24 03:21 PM,11/10/24 03:00 PM - 11/15/24 12:00 PM,Larceny,Palladium Residence Hall,Washington Square,A student reported missing property.,Closed,2024-11-17
2024-3259,11/17/24 12:00 AM,11/17/24 12:00 AM,Harassment / Hate Crime,Washington Square Park,Washington Square,A non-NYU individual reported Harassment with an anti-jewish bias.,Closed/ Referred to NYPD,2024-11-17
03619-2024,11/18/24 10:00 PM,11/17/24 04:45 PM,Liquor Law Violation,Palladium Residence Hall,Washington Square,An RA reported a Liquor Law Violation. (x2),Closed/ Referred to Office of Student Conduct & Community Standards,2024-11-18
2024-3281,11/18/24 10:24 PM,11/18/24 08:30 PM - 11/18/24 10:45 PM,Larceny / Extortion,404 Lafayette Street,Washington Square,A student reported a Larceny and Extortion.,Closed,2024-11-18
03607-2024,11/18/24 05:35 PM,11/17/24 04:30 PM,Liquor Law Violation,Palladium Residence Hall,Washington Square,An RA reported a Liquor Law Violation.,Closed/ Referred to Office of Student Conduct & Community Standards,2024-11-18
03614-2024,11/18/24 06:24 PM,11/18/24 02:45 PM,Liquor Law Violation,Gramercy Green Residence Hall,Washington Square,An RA reported a Liquor Law Violation.,Closed/Referred to Office of Student Conduct & Community Standards,2024-11-18
03622-2024,11/18/24 11:04 PM,11/18/24 08:30 PM,Liquor Law Violation,University Hall,Washington Square,An Ra reported a Liquor Law Violation. (x3),Closed/ Referred to Office of Student Conduct & Community Standards,2024-11-18
2024-3275,11/18/24 06:38 PM,11/18/24 05:40 PM,Harassment,Carlyle Court,Washington Square,A student reported Harassment.,Closed/ Referred to NYPD,2024-11-18
2024-3268,11/18/24 03:43 PM,11/18/24 09:30 AM - 11/18/24 03:34 PM,Larceny,Palladium Residence Hall,Washington Square,A student reported missing property.,Closed,2024-11-18
2024-3279,11/18/24 09:15 PM,11/18/24 08:00 PM - 11/18/24 09:15 PM,Larceny,404 Lafayette Street,Washington Square,A student reported missing property.,Closed,2024-11-18
2024-3264,11/18/24 09:40 AM,11/18/24 09:35 AM,Harassment,E. 26th Street and 1st Avenue,Kips Bay,A student reported Harassment.,Closed,2024-11-18
2024-3267,11/18/24 12:45 AM,11/18/24 11:15 AM - 11/18/24 11:20 AM,Larceny,Palladium Residence Hall,Washington Square,A student reported missing property.,Closed/ Referred to NYPD,2024-11-18
03603-2024,11/18/24 03:26 PM,11/18/24 03:10 PM,Drug Law Violation,Brittany Hall,Washington Square,A student reported illegal Drug Law Violation.,Closed/Referred to Office of Student Conduct & Community Standards,2024-11-18
2024-3269,11/18/24 04:30 PM,11/18/24 09:20 AM - 11/18/24 10:45 AM,Larceny,Silver Center,Washington Square,A student reported missing property.,Closed/ Referred to NYPD,2024-11-18
2024-3272,11/18/24 05:19 PM,11/18/24 01:45 PM - 11/18/24 04:40 PM,Larceny,Tisch Hall,Washington Square,A student reported missing property.,Open,2024-11-18
2024-3274,11/18/24 07:09 PM,11/18/24 11:00 AM - 11/18/24 11:58 AM,Larceny,Palladium Residence Hall,Washington Square,A student reported missing property.,Closed/ Referred to NYPD,2024-11-18
03604-2024,11/18/24 04:25 PM,11/18/24 02:40 PM,Liquor Law Violation,Founders Hall,Washington Square,An RA reported a Liquor Law Violation. (x3),Closed/ Referred to Office of Student Conduct & Community Standards,2024-11-18
03630-2024,11/19/24 12:00 AM,11/19/24 03:09 AM - 11/19/24 06:15 AM,Liquor Law Violation / Drug Law Violation,Founders Residence Hall,Washington Square,An RA reported illegal drug and alcohol possession.,Closed/ Referred to Office of Student Conduct & Community Standards,2024-11-19
03649-2024,11/19/24 11:09 PM,11/19/24 09:00 PM,Liquor Law Violation,University Hall,Washington Square,An RA reported illegal alcohol possession.,Closed/ Referred to Office of Student Conduct & Community Standards,2024-11-19
03646-2024,11/19/24 10:30 PM,11/17/24 12:00 AM,Liquor Law Violation,Palladium Residence Hall,Washington Square,An RA reported illegal alcohol possession. (x2),Closed/ Referred to Office of Student Conduct & Community Standards,2024-11-19
2024-3295,11/19/24 05:44 PM,11/19/24 05:34 PM - 11/19/24 05:40 PM,Harassment,Weinstein Hall - Exterior,Washington Square,An employee reported Harassment.,Closed,2024-11-19
2024-3291,11/19/24 12:50 AM,11/19/24 12:50 AM,Liquor Law Violation / Drug Law Violation / Possession of Stolen Property,Founders Residence Hall,Washington Square,An RA reported illegal drug and alcohol possession / possession of stolen property.,Closed/ Referred to Office of Student Conduct & Community Standards,2024-11-19
2024-3292,11/19/24 03:14 PM,11/19/24 02:30 PM,Larceny,Mercer Street and W 4th Street,Washington Square,A student reported stolen property.,Closed,2024-11-19
2024-3289,11/19/24 01:45 PM,11/19/24 09:45 AM - 11/19/24 01:45 PM,Larceny,Palladium Residence Hall,Washington Square,A student reported missing property.,Closed,2024-11-19
2024-3284,11/19/24 08:23 AM,11/19/24 08:21 AM,Harassment,Basic Science,Kips Bay,A staff member reported Harassment.,Open,2024-11-19
2024-3293,11/19/24 04:16 PM,11/19/24 02:30 PM - 11/19/24 04:10 PM,Larceny,Paulson Center,Washington Square,A student reported missing property.,Open,2024-11-19
03662-2024,11/20/24 09:46 PM,11/20/24 07:10 PM,Liquor Law Violation,University Residence Hall,Washington Square,An RA reported illegal alcohol possession. (x4),Closed/ Referred to Office of Student Conduct & Community Standards,2024-11-20
2024-3311,11/20/24 12:00 AM,11/18/24 01:40 PM - 11/18/24 02:40 PM,Larceny,404 Lafayette Street,Washington Square,A student reported stolen property.,Closed/ Referred to NYPD,2024-11-20
2024-3301,11/20/24 09:45 AM,11/19/24 12:00 AM - 11/19/24 12:40 PM,Larceny,Genomics Center,Washington Square,A student reported missing property.,Open,2024-11-20
03664-2024,11/20/24 11:21 PM,11/19/24 09:00 PM,Disorderly Conduct,Brittany Hall,Washington Square,An RA reported Disorderly Conduct.,Open,2024-11-20
2024-3305,11/20/24 02:00 PM,11/20/24 12:30 PM,Larceny,Third North Residence Hall,Washington Square,An NYU-affiliate reported stolen property.,Open,2024-11-20
2024-3312,11/20/24 04:08 PM,11/20/24 04:08 PM - 11/20/24 04:38 PM,Disorderly Conduct,Schwartz Hall,Kips Bay,A staff member reported Disorderly Conduct.,Closed/ Referred to NYPD,2024-11-20
03757-2024,11/21/24 07:55 PM,11/20/24 12:15 PM,Liquor Law Violation,Founders Residence Hall,Washington Square,A student reported a Liquor Law Violation. x2,Closed/ Referred to Office of Student Conduct & Community Standards,2024-11-21
03669-2024,11/21/24 10:16 AM,11/21/24 12:45 AM,Liquor Law Violation,Weinstein Residence Hall,Washington Square,An RA reported illegal alcohol possession. (x2),Closed/ Referred to Office of Student Conduct & Community Standards,2024-11-21
2024-3319,11/21/24 05:01 PM,11/21/24 03:02 PM - 11/21/24 04:45 PM,Larceny,Genomics Center,Washington Square,A student reported missing property.,Closed,2024-11-21
03672-2024,11/21/24 12:04 PM,11/21/24 10:20 PM,Liquor Law Violation,Weinstein Residence Hall,Washington Square,An RA reported illegal alcohol possession. (x2),Closed/ Referred to Office of Student Conduct & Community Standards,2024-11-21
03693-2024,11/21/24 04:09 PM,11/20/24 03:10 PM,Liquor Law Violation,Carlyle Court Residence Hall,Washington Square,An RA reported illegal alcohol possession. (x4),Closed/ Referred to Office of Student Conduct & Community Standards,2024-11-21
03698-2024,11/21/24 04:37 PM,11/21/24 03:15 PM,Liquor Law Violation,Founders Hall,Washington Square,An RA reported illegal alcohol possession. (x2),Closed/ Referred to Office of Student Conduct & Community Standards,2024-11-21
03703-2024,11/21/24 07:17 PM,11/20/24 07:04 PM,Liquor Law Violation,Sixth Street Residence Hall,Washington Square,An RA reported illegal alcohol possession. (x3),Closed/ Referred to Office of Student Conduct & Community Standards,2024-11-21
03735-2024,11/22/24 06:02 PM,11/20/24 01:00 PM,Liquor Law Violation,Alumni Residence Hall,Washington Square,A student reported a Liquor Law Violation. x2,Closed/ Referred to Office of Student Conduct & Community Standards,2024-11-22
03734-2024,11/22/24 05:59 PM,11/20/24 01:00 PM,Liquor Law Violation,Sixth Street Residence Hall,Washington Square,A student reported a Liquor Law Violation. x2,Closed/ Referred to Office of Student Conduct & Community Standards,2024-11-22
03733-2024,11/22/24 05:54 PM,11/20/24 01:00 PM,Liquor Law Violation,Alumni Residence Hall,Washington Square,A student reported a Liquor Law Violation.,Closed/ Referred to Office of Student Conduct & Community Standards,2024-11-22
03741-2024,11/22/24 07:19 PM,11/22/24 06:11 PM,Drug Law Violation,Carlyle Court,Washington Square,A student reported a Drug Law Violation. x2,Closed/ Referred to Office of Student Conduct & Community Standards,2024-11-22
2024-3344,11/23/24 03:41 PM,11/23/24 02:00 PM - 11/23/24 03:31 PM,Harassment,Bobst Library,Washington Square,A student reported Harassment.,Closed/ Referred to NYPD,2024-11-23
03765-2024,11/23/24 11:57 PM,11/22/24 09:00 AM,Liquor Law Violation,Gramercy Green Residence Hall,Washington Square,A student reported a Liquor Law Violation. x2,Closed/ Referred to Office of Student Conduct & Community Standards,2024-11-23
03759-2024,11/23/24 09:29 PM,11/20/24 02:00 PM,Liquor Law Violation,Alumni Residence Hall,Washington Square,A student reported a Liquor Law Violation.,Closed/ Referred to Office of Student Conduct & Community Standards,2024-11-23
2024-3345,11/23/24 05:05 PM,11/23/24 04:30 PM - 11/23/24 04:40 PM,Criminal Trespass,Furman Hall,Washington Square,A campus safety officer reported a Criminal Trespass.,Closed,2024-11-23
2024-3347,11/23/24 08:20 PM,11/23/24 07:15 PM - 11/23/24 07:50 PM,Larceny,Paulson Center,Washington Square,A student reported a Larceny.,Closed,2024-11-23
2024-3346,11/23/24 05:20 PM,11/23/24 04:30 PM - 11/23/24,Harassment,Greene Street & Waverly Place,Washington Square,A student reported Harassment.,Closed,2024-11-23
03758-2024,11/23/24 05:07 PM,11/22/24 03:41 PM,Liquor Law Violation,Palladium Residence Hall,Washington Square,A student reported a Liquor Law Violation.,Closed/ Referred to Office of Student Conduct & Community Standards,2024-11-23
2024-3349,11/24/24 12:10 AM,11/24/24 12:05 AM - 11/24/24 12:08 AM,Harassment,Dibner Library,Brooklyn Commons,A student reported Harassment.,Open,2024-11-24
2024-3353,11/24/24 05:45 PM,11/24/24 05:39 PM - 11/24/24 05:58 PM,Harassment,404 Lafayette Street - Exterior,Washington Square,A student reported Harassment.,Closed,2024-11-24
2024-3354,11/24/24 08:27 PM,11/24/24 08:20 PM,Robbery,Washington Square Park,Washington Square,A student reported a robbery.,Closed,2024-11-24
03771-2024,11/24/24 11:12 AM,11/24/24 01:15 AM,Liquor Law Violation,Third North Residence Hall,Washington Square,A student reported a Liquor Law Violation. x2,Closed/ Referred to Office of Student Conduct & Community Standards,2024-11-24
2024-3359,11/25/24 10:29 AM,11/25/24 10:18 AM - 11/25/24 10:23 AM,Criminal Trespass,5 Washington Place,Washington Square,A campus safety officer reported a Criminal Trespass.,Closed,2024-11-25
2024-3367,11/25/24 04:36 PM,11/21/24 10:30 PM,Harassment,Ireland House,Washington Square,A staff member reported Harassment.,Open,2024-11-25
2024-3358,11/25/24 09:25 AM,11/25/24 08:56 AM - 11/25/24,Criminal Trespass,Paulson Center,Washington Square,A staff member reported a Criminal Trespass.,Open,2024-11-25
03801-2024,11/25/24 09:21 PM,11/25/24 08:55 PM,Liquor Law Violation,Gramercy Green Residence Hall,Washington Square,A student reported a Liquor Law Violation. x3,Closed/ Referred to Office of Student Conduct & Community Standards,2024-11-25
03800-2024,11/25/24 05:36 PM,11/22/24 10:30 PM,Harassment,Lipton Residence Hall,Washington Square,A student reported Harassment.,Open,2024-11-25
2024-3361,11/25/24 12:35 PM,11/25/24 09:15 AM - 11/25/24 12:30 PM,Larceny,19 West 4th Street - Exterior,Washington Square,A student reported a Larceny.,Closed/ Referred to NYPD,2024-11-25
2024-3379,11/26/24 01:59 PM,11/26/24 01:59 PM - 11/26/24 02:15 PM,Criminal Trespass,Schwartz Hall,Kips Bay,A staff member reported a Criminal Trespass.,Closed/ Referred to NYPD,2024-11-26
2024-3382,11/26/24 03:40 PM,11/26/24 03:12 PM - 11/26/24 03:45 PM,Larceny,Gallatin,Washington Square,A student reported stolen property.,Closed/ Referred to NYPD,2024-11-26
2024-3377,11/26/24 12:39 PM,11/26/24 07:01 AM - 11/26/24 01:15 PM,Bomb Threat/Falsely Reporting an Incident,NYU Bookstore,Washington Square,A staff member reported a Bomb Threat/ Falsely Reporting an Incident.,Closed/ Referred to NYPD,2024-11-26
2024-3378,11/26/24 01:04 PM,11/19/24 03:00 PM - 11/19/24 07:30 PM,Larceny,Schwartz Hall,Kips Bay,A student reported missing property.,Open,2024-11-26
2024-3387,11/27/24 10:45 AM,11/27/24 10:43 AM - 11/27/24 10:45 AM,Criminal Trespass,Founders Hall,Washington Square,A Campus Safety Officer Reported a Criminal Trespass.,Closed/ Referred to NYPD,2024-11-27
2024-3389,11/27/24 11:40 AM,11/26/24 05:00 PM - 12/30/99 12:00 AM,Aggravated Assault,Washington Square South and Thompson Street,Washington Square,NYPD reported an aggravated assault,Closed/ Referred to NYPD,2024-11-27
2024-3391,11/27/24 04:23 PM,11/18/24 08:00 PM - 11/19/24 11:00 AM,Larceny,2 MetroTech,Brooklyn Commons,A student reported a larceny.,Open,2024-11-27
2024-3402,11/29/24 06:32 AM,11/29/24 06:12 AM - 11/29/24 06:18 AM,Larceny,Coral Towers exterior,Washington Square Park,A Campus Safety Officer reported a larceny.,Closed,2024-11-29
2024-3415,12/01/24 10:12 AM,12/01/24 09:30 AM - 12/01/24 09:40 AM,Criminal Trespass,715 Broadway,Washington Square,A staff member reported a criminal trespass.,Open,2024-12-01
2024-3427,12/02/24 12:00 PM,10/03/24 12:00 PM - 12/01/24 12:00 AM,Larceny,Gramercy Green,Washington Square,A student reported Larceny by Extortion.,Closed/ Referred to NYPD,2024-12-02
2024-3438,12/02/24 07:30 PM,12/02/24 07:24 PM - 12/02/24 07:30 PM,Stalking,Bobst Library - Exterior,Washington Square,A student reported Stalking.,Closed,2024-12-02
2024-3440,12/02/24 07:40 PM,12/02/24 05:30 PM - 12/02/24 06:45 PM,Larceny,404 Lafayette,Washington Square,A student reported missing property.,Closed,2024-12-02
2024-3426,12/02/24 11:50 AM,12/02/24 10:48 AM - 12/30/99 12:00 AM,Criminal Trespass,Vanderbilt Hall,Washington Square,A security guard reported a criminal trespass.,Closed,2024-12-02
2024-3449,12/03/24 11:10 PM,12/03/24 11:03 PM,Harassment,157 Bleecker Street - Exterior,Washington Square,A student reported Harassment.,Open,2024-12-03
2024-3442,12/03/24 12:40 PM,12/01/24 01:00 PM - 12/01/24 05:00 PM,Larceny,Bobst Library - Exterior,Washington Square,A student reported stolen property.,Closed,2024-12-03
2024-3444,12/03/24 01:27 PM,11/22/24 10:30 AM,Harassment,Lipton Hall,Washington Square,A staff member reported Harassment.,Closed/ Referred to Office of Student Conduct & Community Standards,2024-12-03
2024-3452,12/04/24 08:30 AM,12/03/24 07:00 PM - 12/04/24 08:20 AM,Larceny,370 Jay Street,Brooklyn Commons,A student reported missing property.,Open,2024-12-04
2024-3453,12/04/24 10:15 AM,10/11/24 - 10/14/24,Burglary,Schwartz Building,Kips Bay,A staff member reported a Burglary.,Open,2024-12-04
2024-3450,12/04/24 04:50 AM,12/04/24 04:45 AM - 12/04/24 04:54 AM,Loitering,Basic Science Building,Kips Bay,A Campus Safety Officer reported Loitering.,Closed/ Referred to NYPD,2024-12-04
2024-3451,12/04/24 09:37 AM,12/04/24 09:29 AM - 12/04/24 09:47 AM,Harassment,Pless Hall,Washington Square,A staff member reported Harassment.,Closed/ Referred to NYPD,2024-12-04
2024-3458,12/05/24 09:20 AM,12/04/24 09:20 PM - 12/05/24 09:20 AM,Larceny,Carlyle Court,Washington Square,A member reported missing property.,Open,2024-12-05
2024-3464,12/05/24 02:01 PM,12/05/24 12:00 AM,Disorderly Conduct / Harassment,Schwartz Building,Kips Bay,A staff member reported Disorderly Conduct / Harassment.,Open,2024-12-05
2024-3466,12/05/24 03:03 PM,12/04/24 - 12/05/24,Harassment,Basic Science Building,Kips Bay,A staff member reported Harassment.,Open,2024-12-05
2024-3471,12/05/24 10:58 PM,12/05/24 12:00 AM,Harassment,Weinstein Hall,Washington Square,An RA reported Harassment.,Closed,2024-12-05
2024-3481,12/06/24 06:50 PM,09/29/24,Harassment,Paulson Center,Washington Square,A student reported Harassment.,Open,2024-12-06
2024-3485,12/07/24 09:25 AM,12/07/24 09:25 AM - 12/07/24 10:00 AM,Bomb Threat / Falsely Reporting an Incident,370 Jay Street,Brooklyn Commons,A staff member reported a Bomb Threat / Falsely Reporting an Incident.,Closed/ Referred to NYPD,2024-12-07
2024-3503,12/08/24 08:05 PM,12/08/24 07:30 PM - 12/08/24 07:50 PM,Larceny,Bobst,Washington Square,A student reported a Larceny.,Closed,2024-12-08
2024-3502,12/08/24 07:55 PM,12/08/24 06:50 PM - 12/08/24 08:10 PM,Larceny,Bobst Library,Washington Square,A student reported a Larceny.,Closed/ Referred to NYPD,2024-12-08
2024-3504,12/08/24 09:30 PM,12/08/24 09:20 PM - 12/08/24,Criminal Trespass,Bobst Library,Washington Square,A staff member reported a Criminal Trespass.,Closed,2024-12-08
2024-3498,12/08/24 03:49 PM,12/08/24 03:49 PM - 12/08/24 04:05 PM,Larceny,45 West 4th Street,Washington Square,A staff member reported a Larceny.,Closed/ Referred to NYPD,2024-12-08
2024-3500,12/08/24 04:09 PM,12/08/24 03:56 PM - 12/8/24 06:25 PM,Criminal Trespass,Bobst Library,Washington Square,A staff member reported a Criminal Trespass.,Closed,2024-12-08
2024-3508,12/09/24 01:10 PM,12/09/24 11:00 AM,Criminal Trespass,Basic Science Building,Kips Bay,A staff member reported a Criminal Trespass,Open,2024-12-09
2024-3509,12/09/24 12:00 AM,12/09/24 11:20 AM - 12/09/24 12:12 PM,Harassment,Schwartz Hall,Kips Bay,A staff member reported Harassment.,Closed/ Referred to NYPD,2024-12-09
2024-3526,12/10/24 12:00 AM,12/10/24 - 12/10/24 07:27 PM,Larceny,Bobst Library,Washington Square,A student reported a Larceny.,Open,2024-12-10
2024-3520,12/10/24 10:12 AM,12/08/24 12:30 PM - 12/08/24 06:00 PM,Larceny,Founders Residence Hall,Washington Square,A student reported a Larceny.,Open,2024-12-10
2024-3536,12/11/24 03:28 PM,12/11/24 03:28 PM - 12/11/24 03:40 PM,Criminal Trespass,16 Washington Place,Washington Square,A staff member reported a Criminal Trespass.,Open,2024-12-11
2024-3534,12/11/24 12:14 PM,12/06/24 - 12/09/24,Larceny,Rogers Hall,Brooklyn Commons,A staff member reported a Larceny.,Open,2024-12-11
2024-3535,12/11/24 12:55 PM,11/07/24 - 12/10/24,Harassment,Wunsch Hall,Brooklyn Commons,A staff member reported Harassment.,Open,2024-12-11
04037-2024,12/12/24 11:56 PM,12/12/24 11:10 PM - 12/12/24 11:25 PM,Liquor Law Violation,Third North Residence Hall,Washington Square,A student reported a Liquor Law Violation. x11,Closed/ Referred to Office of Student Conduct & Community Standards,2024-12-12
2024-3561,12/12/24 06:38 PM,12/12/24 06:00 PM - 12/12/24 06:30 PM,Larceny,Washington Square Park,Washington Square,A student reported a Larceny.,Open,2024-12-12
2024-3557,12/12/24 05:17 PM,12/12/24 05:20 PM - 12/12/24 05:40 PM,Harassment,725 Broadway,Washington Square,A campus safety officer reported Harassment.,Closed/ Referred to NYPD,2024-12-12
2024-3547,12/12/24 02:33 AM,12/11/24 01:00 PM - 12/12/24 02:00 AM,Larceny,Rubin Residence Hall,Washington Square,A student reported a Larceny.,Open,2024-12-12
2024-3551,12/12/24 09:16 AM,12/12/24 09:16 AM - 12/12/24 02:07 PM,"Harassment, Criminal Trespass (x25, 8 later arrested), Disorderly Conduct (16x)",Bobst Library - Exterior,Washington Square,"A campus safety officer reported Harassment, Criminal Trespass, and Disorderly Conduct.",Closed/ Referred to NYPD,2024-12-12
2024-3554,12/12/24 02:56 PM,12/12/24 02:12 PM - 12/12/24 02:29 PM,Harassment / Disorderly Conduct,Schwartz Hall,Kips Bay,A staff member reported Harassment / Disorderly Conduct.,Open,2024-12-12
2024-3573,12/13/24 03:14 PM,12/13/24 01:41 PM - 12/13/24 01:42 PM,Harassment,Palladium Residence Hall,Washington Square,A student reported Harassment.,Closed,2024-12-13
04070-2024,12/13/24 03:00 PM,12/09/24 03:00 AM,Aggravated Assault,Third North Residence Hall,Washington Square,A student reported an Aggravated Assault.,Closed/ Referred to Title IX,2024-12-13
2024-3577,12/13/24 07:18 PM,12/13/24 07:11 PM,Harassment,Bobst Library,Washington Square,A student reported Harassment.,Closed,2024-12-13
2024-3569,12/13/24 08:15 AM,12/13/24 08:15 AM - 12/13/24 09:32 AM,Bomb Threat / Falsely Reporting an Incident,383 Lafayette Street,Washington Square,A staff member reported a Bomb Threat / Falsely Reporting an Incident.,Closed/ Referred to NYPD,2024-12-13
VIC2024-013,12/13/24 01:37 PM,12/06/24 03:30 AM,Criminal Impersonation (x2) and Robbery,Washington Square Park,Washington Square,NYPD reported a robbery and criminal impersonation.,Closed/ Referred to NYPD,2024-12-13
2024-3567,12/13/24 08:01 AM,12/13/24 08:00 AM - 12/13/24 08:20 AM,Criminal Mischief,Bobst Library,Washington Square,A campus safety officer reported Criminal Mischief.,Open,2024-12-13
VIC2024-014,12/15/24 03:38 PM,12/08/24 08:38 PM,Simple Assault,Intersection of Bleeker Street and Mercer Street,Washington Square,NYPD reported a simple assault.,Closed/ Referred to NYPD,2024-12-15
2024-3586,12/16/24 10:02 AM,12/13/24 09:18 AM - 12/13/24 06:14 PM,Harassment,383 Lafayette Street,Washington Square,A staff member reported an Electronic Harassment.,Closed/ Referred to NYPD,2024-12-16
2024-3593,12/16/24 03:35 PM,12/16/24 12:00 AM - 12/16/24 08:00 AM,Larceny,Othmer Residence Hall,Brooklyn Commons,A student reported missing property.,Open,2024-12-16
2024-3595,12/16/24 07:40 PM,12/16/24 04:45 PM - 12/16/24 08:00 PM,Harassment,370 Jay Street,Brooklyn Commons,A student reported Harassment.,Closed,2024-12-16
2024-3603,12/17/24 01:35 PM,12/17/24 12:00 AM,Harassment,Fairchild Hall,Washington Square,A staff member reported Harassment.,Open,2024-12-17
2024-3609,12/17/24 09:36 PM,12/17/24 09:36 PM - 12/30/99 10:03 PM,Criminal Mischief,Lafayette Residence Hall,Washington Square,A student reported property damage.,Closed,2024-12-17
04101-2024,12/18/24 03:47 PM,12/18/24 03:30 PM,Liquor Law Violation,Coral Tower Residence Hall,Washington Square Park,A student reported a Liquor Law Violation. (x6),Closed/ Referred to Office of Student Conduct & Community Standards,2024-12-18
2024-3616,12/18/24 05:27 PM,12/18/24 04:40 PM - 12/18/24 05:10 PM,Larceny,6 MetroTech Center,Brooklyn Commons,A student reported missing property.,Open,2024-12-18
2024-3614,12/18/24 04:30 PM,12/18/24 02:30 PM - 12/18/24 04:30 PM,Harassment,Meyer Building,Washington Square,A student reported Harassment.,Open,2024-12-18
2024-3612,12/18/24 03:00 PM,12/09/24 10:20 AM - 12/09/24 10:21 AM,Larceny,Silver Building,Washington Square,A student reported missing property.,Open,2024-12-18
2024-3610,12/18/24 12:10 AM,12/18/24 12:10 AM - 12/18/24 01:50 AM,Bomb Threat/ Falsely Reporting an Incident,Bobst Library,Washington Square,An NYU-affiliate reported a Bomb Threat/ Falsely Reporting an Incident.,Open,2024-12-18
2024-3613,12/18/24 03:03 PM,12/18/24 03:02 PM - 12/18/24 03:15 PM,Aggravated Assault,2 Washington Village - Exterior,Washington Square,A Campus Safety Officer reported reckless driving and a hit-and-run.,Closed/ Referred to NYPD,2024-12-18
04120-2024,12/19/24 09:24 PM,12/18/24 09:24 PM,Criminal Mischief,Brittany Hall,Washington Square,A student reported Criminal Mischief.,Closed/ Referred to Office of Student Conduct & Community Standards,2024-12-19
2024-3621,12/19/24 02:50 AM,12/18/24 05:00 PM - 12/19/24 02:30 AM,Larceny,6 MetroTech Center,Brooklyn Commons,A student reported missing property.,Closed,2024-12-19
2024-3628,12/19/24 08:47 PM,12/09/24 12:00 PM - 12/19/24 08:35 PM,Larceny,Weinstein Hall,Washington Square,A student reported missing property.,Closed,2024-12-19
04116-2024,12/19/24 04:44 PM,12/19/24 04:30 PM,Liquor Law Violation,Palladium Residence Hall,Washington Square,An RA reported a Liquor Law Violation. (x3),Closed/ Referred to Office of Student Conduct & Community Standards,2024-12-19
04117-2024,12/19/24 04:48 PM,12/19/24 04:30 PM,Liquor Law Violation,Palladium Residence Hall,Washington Square,An RA reported a Liquor Law Violation. (x2),Closed/ Referred to Office of Student Conduct & Community Standards,2024-12-19
2024-3629,12/20/24 01:29 AM,12/20/24 01:29 AM - 12/20/24 01:59 AM,Simple Assault,Schwartz Plaza,Washington Square,A Campus Safety Officer reported a Simple Assault.,Closed/ Referred to NYPD,2024-12-20
2024-3634,12/20/24 10:00 AM,12/20/24 09:00 AM - 12/20/24 09:45 AM,Larceny,Palladium Residence Hall,Washington Square,An individual reported a Larceny.,Closed/ Referred to NYPD,2024-12-20
2024-3635,12/20/24 12:19 AM,12/09/24 12:20 PM - 12/09/24,Harassment,Skirball Theater,Washington Square,A staff member reported Harassment.,Open,2024-12-20
2024-3638,12/20/24 09:22 PM,12/20/24 08:11 PM - 12/20/24,Larceny,Broadway & West 3rd Street,Washington Square,A student reported a Larceny.,Closed/ Referred to NYPD,2024-12-20
04146-2024,12/21/24 10:10 PM,12/24/24 09:36 PM,Criminal Mischief,University Hall,Washington Square,A student reported Criminal Mischief.,Closed/ Referred to Office of Student Conduct & Community Standards,2024-12-21
2024-3639,12/21/24 12:08 PM,12/21/24 12:00 PM - 12/21/24,Harassment,Washington Square Park,Washington Square,A student reported Harassment.,Closed,2024-12-21
2024-3641,12/21/24 10:09 PM,12/21/24 10:15 PM - 12/21/24 10:17 PM,Falsely Reporting an Incident,Broome Street Residence,Washington Square,An individual Falsely Reported an Incident.,Closed/ Referred to NYPD,2024-12-21
2024-3645,12/24/24 10:20 AM,12/21/24 05:00 PM - 12/22/24 11:00 AM,Larceny,University Hall,Washington Square,A staff member reported a Larceny.,Closed,2024-12-24
2024-3650,12/26/24 02:38 PM,11/12/24 12:00 AM,Harassment,Palladium Residence Hall,Washington Square,A student reported Harassment.,Open,2024-12-26
2024-3651,12/26/24 03:06 PM,12/26/24 02:50 PM - 12/26/24 02:55 PM,Criminal Mischief,Schwartz Hall,Kips Bay,A security officer reported Criminal Mischief.,Closed/ Referred to NYPD,2024-12-26
2024-3652,12/26/24 05:35 PM,12/18/24 10:00 AM - 12/18/24 11:50 AM,Larceny,Warren Weaver Hall,Washington Square,A student reported a Larceny.,Closed,2024-12-26
2024-3653,12/26/24 08:49 PM,12/26/24 11:30 AM - 12/26/24 08:48 PM,Larceny,Gramercy Green Residence Hall,Washington Square,A student reported a Larceny.,Open,2024-12-26
2024-3655,12/27/24 02:41 PM,12/27/24 02:30 PM - 12/27/24 02:40 PM,Robbery,721 Broadway - Exterior,Washington Square,A student reported a Robbery.,Closed,2024-12-27
2025-0007,1/2/2025 6:48 pm,1/2/2025 6:40 PM - 1/2/2025 7:08 PM,Loitering,370 Jay Street,Brooklyn Commons,A Campus Safety Officer reported Loitering.,Closed,2025-01-02
2025-0016,1/3/2025 3:46 pm,1/3/2025 3:36 PM - 1/3/2025 3:43 PM,Criminal Trespass,Shimkin Hall,Washington Square,A Campus Safety Officer reported Criminal Trespass.,Closed,2025-01-03
2025-0013,1/3/2025 2:19 pm,12/19/2024 10:00 AM - 12/22/2024 9:24 AM,Larceny,Kimmel Center - Exterior,Washington Square,A student reported stolen property.,Closed,2025-01-03
2025-0023,1/6/2025 9:26 AM,1/6/2025 9:35 AM - 1/6/2025 11:25 AM,Bomb Threat / Falsely Reporting an Incident,400 Lafayette Street,Washington Square,A staff member reported a Bomb Threat / Falsely Reporting an Incident.,Closed / Referred to NYPD,2025-01-06
2025-0036,1/9/2025 12:02 PM,1/9/2025 11:57 AM,Harassment,NYU Bookstore - Exterior,Washington Square,A staff member reported Harassment.,Open,2025-01-09
2025-0041,1/9/2025 8:25 PM,1/9/2025 8:25 PM,Criminal Mischief,Paulson Center,Washington Square,A student reported destruction of property.,Closed,2025-01-09
2025-0044,01-10-2025 4:06pm,01-08-2025 4:30pm - 01-09-2025 7:00pm,Larceny,Palladium Hall,Washington Square,A student reported items taken from the laundry room.,Closed,2025-01-10
2025-0046,01-10-2025 5:05 pm,01-10-2025 12:40 pm - 01-10-2025 3:40 pm,Larceny,Bobst Library,Washington Square,A student reported a theft.,Open,2025-01-10
2025-0048,01-10-2025 11:06 pm,10-09-2024,Fondling,380 2nd Avenue,Kips Bay,A student reported fondling (x2).,Open,2025-01-10
00032-2025,01-10-2025 2:38 pm,01-09-2025 8:25 pm,Criminal Mischief,Paulson Center,Washington Square,A student reported vandalism.,Closed/ Referred to Office of Student Conduct & Community Standards,2025-01-10
2025-0052,01-11-2025 7:30 pm,01-11-2025 2:45 pm,Robbery,20 Astor Place (exterior),Washington Square,A student reported a robbery.,Closed/ Referred to NYPD,2025-01-11
2025-0049,01-11-2025 4:01 am,01-11-2025 3:55 am,Criminal Mischief,Meyer Hall exterior,Washington Square,A Campus Safety Officer witnessed vandalism.,Closed,2025-01-11
2025-0051,01-11-2025 8:40 am,01-11-2025 8:10 am,Criminal Mischief,721 Broadway exterior,Washington Square,A Campus Safety Officer reported vandalism.,Closed/ Referred to NYPD,2025-01-11
2025-0063,1/13/2025 3:54 PM,1/13/2025 2:45 PM,Traffic Law Violation,2 Washington Square Village (exterior),Washington Square,A staff member reported a hit and run accident.,Closed,2025-01-13
2025-0062,1/13/2025 3:18 PM,1/13/2025 2:35 PM,Larceny,Palladium Hall,Washington Square,A student reported lost money.,Closed,2025-01-13
IRVS 2025-001,1/14/2025 3:54 PM,1/11/2025 3:12 AM,Criminal Mischief,Bronfman Center (exterior),Washington Square,NYPD reported a damaged car.,Closed/ Referred to NYPD,2025-01-14
00049-2025,1/14/2025 12:44 PM,1/1/2025 - 1/3/2025,Stalking,Silver Center,Washington Square,A student reported stalking.,Closed/ Referred to Title IX,2025-01-14
2025-0071,1/14/2025 3:25 PM,1/14/2025 3:25 PM - 1/14/2025 3:40 PM,Disorderly Conduct,Schwartz Hall,Kips Bay,A staff member reported disorderly conduct.,Open,2025-01-14
2025-0083,1/15/2025 3:30 PM,1/15/2025 3:29 PM,Harassment,"721 Broadway, exterior on Waverly Place",Washington Square,A faculty member reported harassment.,Open,2025-01-15
2025-0081,1/15/2025 3:07 PM,1/15/2025 2:15 PM,Harassment,Sullivan Street at West 3rd Street,Washington Square,A faculty member reported Harassment.,Open,2025-01-15
2025-0082,1/15/2025 3:10 PM,1/15/2025 2:10 PM,Fondling / Harassment,Washington Square Park,Washington Square,Two students reported Fondling / Harassment.,Open,2025-01-15
2025-0078,1/15/2025 12:10 PM,1/15/2025 12:06 PM,Fondling,Washington Square Park,Washington Square,A student reported a Fondling.,Closed/ Referred to NYPD,2025-01-15
2025-0080,1/15/2025 1:58 PM,1/15/2025 1:56 PM,Criminal Mischief,Carlyle Court - Exterior,Washington Square,A staff member reported Criminal Mischief.,Closed/ Referred to NYPD,2025-01-15
2025-0084,1/16/2025 9:48 AM,1/14/2025 12:01 PM - 1/15/2025 9:46 AM,Larceny,Rogers Hall,Brooklyn Commons,An employee reported a larceny.,Open,2025-01-16
2025-0094,1/17/2025 1:53 PM,1/9/2025 12:00 PM,Public Lewdness,6 MetroTech,Brooklyn Commons,A student reported public lewdness.,Closed/ Referred to Title IX,2025-01-17
2025-0116,01-17-2025 8:46 pm,01-08-2025 9:00 am - 01-17-2025 10:00 am,Harassment,Kaufman Management Center,Washington Square,Staff reported harassing phone calls.,Closed,2025-01-17
2025-0116,1/17/2025 8:46 PM,1/8/2025 9:00 AM - 1/17/2025 10:00 AM,Harassment,Kaufman Management Center,Washington Square,Staff reported harassing phone calls.,Open,2025-01-17
2025-0098,1/18/2025 6:00 PM,01-07-2025 - 01-08-2025,Larceny,Lafayette Hall,Washington Square,A student reported a larceny.,Open,2025-01-18
2025-0099,1/18/2025 7:43 PM,1/18/2025 3:02 PM,Traffic Law Violation,Paulson Center exterior,Washington Square,A Campus Safety Officer reported a hit and run accident.,Closed,2025-01-18
00067-2025,1/19/2025 11:54 PM,1/19/2025 11:05 PM,Liquor Law Violation,Third North,Washington Square,A Resident Assistant reported a Liquor Law Violation (16x).,Closed/ Referred to Office of Student Conduct & Community Standards,2025-01-19
2025-0102,1/19/2025 2:38 PM,1/19/2025 2:38 PM,Criminal Trespass,Meyer Hall,Washington Square,A Campus Safety Officer reported a Criminal Trespass.,Closed,2025-01-19
00075-2025,1/20/2025 4:27 PM,1/20/2025 4:05 PM,Larceny,Founders Hall,Washington Square,A Resident Assistant reported a larceny.,Closed/ Referred to Office of Student Conduct & Community Standards,2025-01-20
00068-2025,1/20/2025 12:59 AM,1/19/2025 12:00 PM - 01/19/2025 10:41 pm,Simple Assault,Brittany Hall,Washington Square,A student reported a simple assault.,Closed/ Referred to Office of Student Conduct & Community Standards,2025-01-20
2025-3016,01/21/2025 2:41 PM,01-2025 - 10/21/2025,Harassment,Meyer Hall,Washington Square,A staff member reported Harassment.,Open,2025-01-21
2025-0122,1/21/2025 4:10 PM,1/21/2025 2:33 PM - 1/21/2025 4:28 PM,Harassment and Loitering,45 West 4th St.,Washington Square,A Starbucks employee reported harassment and loitering.,Closed,2025-01-21
OEO-2025- 001,01-22-2025 4:07 pm,01-21-2025 5:51 pm,Criminal Mischief,"Washington Square Park, north entrance",Washington Square,A staff member reported a social media showing vandalism.,Open,2025-01-22
2025-0132,01-22-2025 10:28 AM,01-22-2025 10:28 AM - 01-22-2025 11:44 PM,Disorderly Conduct,Schwartz Hall,Kips Bay,A student reported Disorderly Conduct.,Closed/ Referred to NYPD,2025-01-22
2025-0133,01-22-2025 12:47 PM,01-17-2025 12:19 PM 01-17-2025 8:00 PM,Larceny,15 Washington Place,Washington Square,A staff member reported missing property.,Closed,2025-01-22
2025-0138,01-22-2025 4:19 PM,01-25-2025 - 01-22-2025,Harassment,Weinstein Hall,Washington Square,A student reported Harassment.,Open,2025-01-22
2025-0146,1/23/2025 9:03 PM,1/23/2025 1:56 PM - 1/23/2025 9:00 PM,Larceny,Coral Towers,Washington Square,A student reported a larceny,Closed,2025-01-23
2025-0150,01-24-2025 7:45 AM,01-20-2025 5:45 PM 01-20-2025 5:55 PM,Disorderly Conduct,561 LaGuardia,Washington Square,A Campus Safety Officer reported Disorderly Conduct.,Closed,2025-01-24
2025-0157,01-24-2025 2:48 PM,01-24-2025 01-24-2025 2:48 PM,Harassment,Broadway near Grace Church on 10th Stre,Washington Square,A student reported Harassment.,Closed,2025-01-24
00132-2025,01-24-2025 11:58 PM,01-24-2025 10:35 PM,Liquor Law Violation (x5),Rubin Hall,Washington Square,An RA reported underage alcohol possession.,Closed/ Referred to Office of Student Conduct & Community Standards,2025-01-24
2025-0163,01-25-2025 12:04 AM,01-03-2025 8:00 AM 01-25-2025 2:20 AM,Larceny,Lafayette Hall,Washington Square,A student reported stolen property.,Closed/ Referred to NYPD,2025-01-25
2025-0169,01-25-2025 9:33 PM,01-25-2025 6:50 PM 01-25-2025 9:18 PM,Larceny,Othmer Hall,Brooklyn Commons,A student reported missing property.,Open,2025-01-25
00149-2025,01-26-2025 12:57 AM,01-26-2025 12:05 AM,Liquor Law Violation,Carlyle Court Residence Hall,Washington Square,A student reported a Liquor Law Violation.,Closed/ Referred to Office of Student Conduct & Community Standards,2025-01-26
00151-2025,01-26-2025 12:21 AM,01-25-2025 11:08 PM,Liquor Law Violation (x28),Brittany Hall,Washington Square,An RA reported underage drinking.,Closed/ Referred to Office of Student Conduct & Community Standards,2025-01-26
00167-2025,01-27-2025 10:53 AM,01-16-2025 3:06 AM,Criminal Mischief,Third Avenue North Residence Hall,Washington Square,An RA reported graffiti.,Open,2025-01-27
2025-0186,01-27-2025 2:37 PM,01-21-2025 12:00 PM 01-27-2025 2:03 PM,Larceny,Paulson Center,Washington Square,A staff member reported missing property.,Closed,2025-01-27
2025-0187,01-27-2025 5:30 PM,01-27-2025 5:05 PM,Harassment,Ireland House - Exterior,Washington Square,A staff member reported Harassment.,Closed,2025-01-27
2025-0185,01-27-2025 1:45 PM,01-27-2025 1:37 PM 01-27-2025 1:40 PM,Larceny,Paulson Center,Washington Square,A student reported missing property.,Closed,2025-01-27
2025-0180,01-27-2025 9:53 AM,01-27-2025 9:00 AM N/A,Fondling,Lafayette Street and East 4th Street,Washington Square,A student reported a Fondling.,Closed,2025-01-27
2025-0189,01-27-2025 6:26 PM,01-27-2025 6:25 PM 01-27-2025 6:50 PM,Criminal Trespass,10 Washington Mews,Washington Square,A contractor reported a Criminal Trespass.,Closed/ Referred to NYPD,2025-01-27
2025-0195,01-28-2025 3:41 PM,12-13-2024 10:15 AM 12-13-2024 4:00 PM,Harassment,383 Lafayette Street,Washington Square,A Campus Safety Officer reported Harassment.,Closed,2025-01-28
2025-0197,01-28-2025 4:30 PM,01-28-2025 4:30 PM 01-28-2025 4:40 PM,Harassment,Schwartz Hall,Kips Bay,A staff member reported Harassment.,Open,2025-01-28
2025-0200,01-28-2025 4:00 PM,01-28-2025 3:45 PM,Larceny,West 3rd Street and Mercer Street,Washington Square,A student reported stolen property.,Closed/ Referred to NYPD,2025-01-28
2025-0204,01-28-2025 8:17 PM,01-28-2025 8:30 AM 01-28-2025 7:50 PM,Larceny,Gallatin Building,Washington Square,A student reported missing property.,Closed,2025-01-28
00188-2025,01-28-2025 11:11 AM,01-27-2025 4:30 PM,Stalking / Fondling,Gramercy Green Residence Hall,Washington Square,A student reported Stalking and Fondling.,Closed/ Referred to Title IX,2025-01-28
2025-0208,01-29-2025 11:16 AM,01-29-2025 10:25 AM 01-29-2025 12:18 PM,Disorderly Conduct,Schwartz Hall,Kips Bay,A staff member reported Disorderly Conduct.,Closed/ Referred to NYPD,2025-01-29
2025-0215,01-29-2025 8:20 PM,01-29-2025 7:35 PM 01-29-2025 7:38 PM,Harassment,Zurich Hall,Washington Square,A faculty member reported Harassment.,Closed,2025-01-29
2025-0225,01-30-2025 1:26 PM,01-30-2025 11:20 AM 01-30-2025 11:50 AM,Disorderly Conduct /Harassment,Schwartz Hall,Kips Bay,A staff member reported Harassment and Disorderly Conduct.,Open,2025-01-30
2025-0230,01-30-2025 8:29 PM,01-30-2025 8:26 PM 01-30-2025 8:44 PM,Criminal Trespass,Lipton Hall,Washington Square,A Campus Safety Officer reported Criminal Trespass.,Closed,2025-01-30
00227-2025,01-30-2025 8:41 PM,12-25-2024 - 01-30-2025,Stalking,Lafayette Hall,Washington Square,A student reported Stalking.,Closed/ Referred to NYPD,2025-01-30
2025-0228,01-30-2025 4:00 PM,09-00-2025 - 01-30-2025,Stalking,6 Washington Place,Washington Square,A student reported Stalking.,Closed,2025-01-30
00221-2025,01-30-2025 2:37 PM,01-29-2025 11:00 AM 01-29-2025 12:00 PM,Harassment,Bobst Library - Exterior,Washington Square,A student reported Harassment.,Open,2025-01-30
2025-0226,01-30-2025 3:08 PM,01-30-2025 2:41 PM 01-30-2025 2:50 PM,Disorderly Conduct / Harassment,Schwartz Hall,Kips Bay,A staff member reported Disorderly Conduct and Harassment.,Open,2025-01-30
2025-0238,01-31-2025 11:27 AM,01-26-2025 5:54 AM 01-26-2025 1:00 PM,Larceny,Hayden Hall,Washington Square,A student reported missing property.,Open,2025-01-31
2025-0235,01-31-2025 9:05 AM,01-30-2025 5:00 PM 01-31-2025 8:53 AM,Larceny,Kimmel Center,Washington Square,A student reported missing property.,Closed/ Referred to NYPD,2025-01-31
2025-0251,02-01-2025 6:00 PM,02-01-2025 12:51 PM 02-01-2025 6:00 PM,Larceny,725 Broadway,Washington Square,A student reported missing property.,Open,2025-02-01
00248-2025,02-01-2025 3:14 AM,01-31-2025 11:00 PM,Harassment,Gramercy Green Residence Hall,Washington Square,A student reported Harassment.,Closed/ Referred to Office of Student Conduct & Community Standards,2025-02-01
2025-0261,02-02-2025 9:16 PM,02-02-2025 9:13 PM 02-02-2025 10:47 PM,Harassment / Dating Violence,Alumni Hall,Washington Square,A student reported Harassment by an intimate partner.,Closed/ Referred to NYPD,2025-02-02
2025-0263,02-03-2025 9:30 AM,02-02-2025 8:25 PM 02-03-2025 9:17 AM,Harassment,Palladium Hall,Washington Square,A staff member reported Harassment.,Closed,2025-02-03
IRVS 2025- 003,02-03-2025 10:57 am,01-14-2025 4:00 pm 01-14-2025 6:00 pm,Harassment,Wiseman Hall (exterior),Kips Bay,NYPD reported a physical fight.,Closed/ Referred to NYPD,2025-02-03
00296-2025,02-04-2025 9:43 PM,10-31-2024,Rape,Lipton Hall,Washington Square,A student reported sexual violence.,Closed/ Referred to Title IX,2025-02-04
00291-2025,02-04-2025 1:50 PM,02-04-2025 12:25 PM,Harassment,Palladium Hall,Washington Square,A student reported Harassment.,Closed/ Referred to Office of Student Conduct & Community Standards,2025-02-04
2025-0291,02-04-2025 11:39 PM,02-04-2025 11:10 PM,Harassment,Cantor Film Center - Exterior,Washington Square,A student reported Harassment.,Closed,2025-02-04
2025-0298,02-05-2025 3:58 PM,02-04-2025 9:30 PM 02-05-2025 1:30 AM,Larceny,Palladium Hall,Washington Square,A student reported missing property.,Closed/ Referred to NYPD,2025-02-05
2025-0300,02-05-2025 7:31 PM,02-05-2025 1:00 PM 02-05-2025 7:00 PM,Larceny,Weinstein Hall,Washington Square,A student reported missing property.,Open,2025-02-05
2025-0302,02-05-2025 7:07 PM,02-05-2025 9:07 PM,Harassment,404 Lafayette Street,Washington Square,A student reported Harassment.,Open,2025-02-05
00309-2025,02-05-2025 6:25 PM,02-02-2025,Drug Law Violation,University Hall,Washington Square,A student reported illegal drug possession.,Closed/ Referred to Office of Student Conduct & Community Standards,2025-02-05
00302-2025,02-05-2025 10:42 AM,10-26-2024 12-13-2024,Stalking,Palladium Residence Hall,Washington Square,A student reported Stalking.,Closed/ Referred to Title IX,2025-02-05
2025-0293,02-05-2025 9:01 AM,02-04-2025 10:00 PM 02-05-2025 8:52 AM,Larceny,Weinstein Hall,Washington Square,A staff member reported missing property.,Closed,2025-02-05
2025-0303,02-05-2025 8:15PM,02-04-2025 8:00 PM 02-05-2025,Larceny,Silver Main,Washington Square,A student reported missing property.,Closed,2025-02-05
2025-0319,02-06-2025 6:07 PM,02-06-2025 6:05 PM 02-06-2025 6:13 PM,Criminal Trespass,Bobst Library,Washington Square,A Campus Safety Officer reported Criminal Trespass.,Open,2025-02-06
00371-2025,2/6/2025 5:00 PM,2/6/2025 8:00 AM - 2/6/2025 9:00 AM,Sexual Abuse,Paulson Center,Washington Square,A student reported Sexual Abuse.,Closed/ Referred to Title IX,2025-02-06
00317-2025,02-06-2025 11:44 AM,02-06-2025 1:40 AM,Harassment,Lipton Hall,Washington Square,A student reported Harassment.,Closed/ Referred to Office of Student Conduct & Community Standards,2025-02-06
2025-0322,02-07-2025 2:34 PM,02-06-2025 11:00 PM - 02-07-2025 2:15 PM,Larceny,Third North Hall,Washington Square,A student reported a lost item.,Closed,2025-02-07
2025-0330,02-08-2025 8:16 PM,02-08-2025 7:30 p.m.,Larceny,Palladium Hall,Washington Square,A student reported a theft.,Closed,2025-02-08
00342-2025,2/9/2025 12:22 AM,2/8/2025 10:15 PM,Liquor Law Violation (x10),Paulson Center,Washington Square,A resident assistant reported a liquor law violation.,Closed/ Referred to Office of Student Conduct & Community Standards,2025-02-09
2025-0332,2/9/2025 1:50 AM,2/8/2025 10:30 PM - 2/9/2025 1:00 AM,Larceny,Founders Hall,Washington Square,A student reported a Larceny.,Closed,2025-02-09
2025-0333,2/9/2025 3:46 AM,2/9/2025 3:45 AM,Aggravated Assault,Founders Hall (exterior),Washington Square,A student reported an Aggravated Assault.,Closed,2025-02-09
00366-2025,2/9/2025 19:15,02-08-2025,Larceny,Clark Street Hall,Brooklyn Commons,A student reported a larceny.,Closed/ Referred to NYPD,2025-02-09
2025-0351,2/10/2025 9:26 PM,2/10/2025 9:10 PM,Criminal Mischief,Meyer Hall Place (exterior),Washington Square,A Campus Safety Officer reported vandalism.,Closed/ Referred to NYPD,2025-02-10
2025-0351,2/10/2025 9:26 PM,2/10/2025 8:30 PM,Criminal Mischief (x2),Gould Plaza,Washington Square,A Campus Safety Officer reported vandalism.,Closed/ Referred to NYPD,2025-02-10
2025-0351,2/10/2025 9:26 PM,2/10/2025 8:30 PM,Criminal Mischief,Warren Weaver Hall,Washington Square,A Campus Safety Officer reported vandalism.,Closed/ Referred to NYPD,2025-02-10
2025-0355,2/11/2025 9:19 am,1/29/2025 12:30 pm,Harassment,Bobst Library (exterior),Washington Square,A student reported harassment.,Open,2025-02-11
2025-0360,2/11/2025 12:38 pm,1/30/2025 6:00 pm - 2/6/2025 2:00 pm,Criminal Mischief,370 Jay Street,Brooklyn Commons,A staff member reported vandalism.,Open,2025-02-11
2025-0362,2/11/2025 2:30 pm,2/11/2025 2:05 pm,Larceny,Silver Center,Washington Square,A student reported a theft.,Open,2025-02-11
00377-2025,2/11/2025 1:16 pm,2/11/2025 12:06 pm,Liquor Law Violation (x2),Brittany Hall,Washington Square,A staff member confiscated alcohol.,Closed/ Referred to Office of Student Conduct & Community Standards,2025-02-11
00379-2025,2/11/2025 2:47 pm,2/9/2025 6:40 pm,Harassment,Gramercy Green,Washington Square,A student reported Harassment.,Closed/ Referred to Office of Student Conduct & Community Standards,2025-02-11
2025-0365,2/11/2025 5:43 pm,2/6/2025 11:00 am - 2/6/2025 at 2:00 pm,Larceny,Kimball Hall,Washington Square,An employee reported a larceny.,Closed,2025-02-11
2025-0356,2/11/2025 9:32 pm,2/4/2025 12:22 pm - 2/4/2025 12:31 pm,Larceny,Kaufman Management Center,Washington Square,A student reported a larceny.,Closed,2025-02-11
2025-0371,2/12/2025 10:33 am,2/5/2025 8:00 pm - 2/12/2025 10:32 am,Stalking,Lipton Hall (exterior),Washington Square,A student reported stalking.,Closed,2025-02-12
2025-0372,2/12/2025 10:56 am,2/12/2025 10:49 pm,Harassment (x2),Fairchild Hall,Washington Square,A student and a Campus Safety Officer reported harassment.,Open,2025-02-12
2025-0380,2/12/2025 7:22 pm,2/11/2025 5:30 pm,Public Lewdness,Washington Square North at Waverly Place,Washington Square,A faculty member reported public lewdness.,Closed,2025-02-12
00394-2025,2/12/2025 7:00 pm,2/12/2025 6:00 pm,Larceny,Brittany Hall,Washington Square,A student reported a Larceny,Closed/ Referred to Office of Student Conduct & Community Standards,2025-02-12
2025-0377,2/12/2025 6:29 pm,2/12/2025 6:15 pm,Larceny,Paulson Center,Washington Square,A student reported a larceny.,Open,2025-02-12
2025-0384,02-13-2025 10:05 am,02-13-2025 8:40 am - 02-13-2025 10:05 am,Larceny,Paulson Center,Washington Square,A student reported a larceny.,Open,2025-02-13
2025-0398,02-13-2025 10:56 PM,02-13-2025 10:56 PM,Criminal Mischief,561 LaGuardia Place - Exterior,Washington Square,A Campus Safety Officer reported Criminal Mischief.,Closed/ Referred to NYPD,2025-02-13
2025-0388,02-13-2025 2:05 pm,02-13-2025 2:00 pm,Harassment,Southwest corner of Waverly Place and University Place,Washington Square,A student reported Harassment.,Open,2025-02-13
2025-0385,02-13-2025 11:02 am,02-12-2025 9:11 am - 02-12-2025 12:11 pm,Harassment,Schwartz Hall,Kips Bay,A staff member reported harassment.,Open,2025-02-13
2025-0391,02-13-2025 2:24 pm,02-13-2025 1:45 pm,Harassment,Washington Square North at 5th Avenue,Washington Square,A staff member reported Harassment.,Open,2025-02-13
2025-0389,02-13-2025 3:30 pm,02-13-2025 1:45 pm,Harassment,Washington Square North near 5th Avenue,Washington Square,A student reported Harassment.,Open,2025-02-13
2025-0401,02-14-2025 4:40 AM,02-13-2025 4:40 AM,Harassment,Palladium Hall,Washington Square,A student reported Harassment.,Closed/ Referred to NYPD,2025-02-14
2025-0403,02-14-2025 7:21 AM,02-14-2025 7:21 AM,Criminal Mischief,561 LaGuardia Place - Exterior,Washington Square,A Campus Safety Officer reported Criminal Mischief.,Closed/ Referred to NYPD,2025-02-14
00411-2025,02-14-2025 12:43 AM,02-13-2025 11:46 PM,Liquor Law Violation (x2),Weinstein Residence Hall,Washington Square,An RA reported illegal possession of alcohol.,Closed/ Referred to Office of Student Conduct & Community Standards,2025-02-14
2025-0406,2/14/2025 12:05 pm,2/13/2025 11:00 pm -2/14/2025 12:02 PM,Larceny,Lipton Hall (exterior),Washington Square,A student reported a stolen bike.,Closed,2025-02-14
2025-0410,2/14/2025 4:05 pm,2/3/2025 10:15 am - 2/11/2025,Dating Violence / Stalking,80 Lafayette,Washington Square,A student reported dating violence and stalking.,Open,2025-02-14
2025-0417,2/15/2025 11:25 am,2/13/2025 4:00 pm - 2/13/2025 5:00 PM,Larceny,Rogers Hall,Washington Square,A dining staff member reported a larceny.,Open,2025-02-15
2025-0420,2/15/2025 7:30 pm,2/15/2025 7:11 PM,Harassment,Washington Square Park,Washington Square,A student reported harassment.,Open,2025-02-15
2025-0429,2/16/2025 5:24 pm,2/16/2025 3:25 PM,Criminal Impersonation,Kimmel Center,Washington Square,A staff member reported a false phone call.,Open,2025-02-16
2025-0439,2/17/2025 1:43 pm,2/14/2025 2:35 PM,Harassment,18 Washington Place (exterior),Washington Square,A student member reported harassment.,Open,2025-02-17
2025-0443,2/17/2025 9:33 PM,1/1/2025- 2/17/2025 8:11 PM,Criminal Impersonation with the Intent to Defraud Another,Weinstein Residence Hall,Washington Square,A student reported Criminal Impersonation.,Closed,2025-02-17
2025-0444,2/17/2025 11:28 PM,2/17/2025 12:00:00 PM - 2/17/2025 11:00:00 PM,Larceny,Third North Residence Hall,Washington Square,A student reported a Larceny.,Closed/ Referred to NYPD,2025-02-17
2025-0451,2/18/2025 7:00 PM,2/18/2025 4:00:00 PM - 2/18/2025 6:30:00 PM,Larceny,404 Lafayette Street,Washington Square,A student reported a Larceny.,Closed,2025-02-18
2025-0446,2/18/2025 9:33 AM,2/18/2025 8:00:00 AM - 2/18/2025 9:20:00 AM,Larceny,Paulson Center,Washington Square,A student reported a Larceny.,Open,2025-02-18
2025-0449,2/18/2025 2:43 PM,2/18/2025 1:00:00 PM - 2/18/2025 1:10:00 PM,Matter of Record (reclassified from Larceny),Schwartz Hall,Kips Bay,A staff member reported a Larceny.,Closed/ Referred to NYPD,2025-02-18
2025-0458,2/19/2025 10:07 AM,2/19/2025 8:45:00 AM - 2/19/2025 9:26:00 AM,Harassment,Schwartz Hall,Kips Bay,A Campus Safety Officer reported Harassment.,Closed/ Referred to NYPD,2025-02-19
00496-2025,02-19-2025 10:45 PM,02-19-2025 7:20 PM - 02-19-2025 7:30 PM,Loitering,2nd Street Residence Hall,Washington Square,An RA reported Loitering.,Open,2025-02-19
00491-2025,02-19-2025 3:05 PM,02-19-2025 2:00 PM,Harassment,433 1st Avenue,Kips Bay,A student reported Harassment.,Open,2025-02-19
2025-0457,2/19/2025 9:54 AM,02-19-2025 -2/19/2025 9:20:00 AM,Criminal Trespass,Paulson Center,Washington Square,A Campus Safety Officer reported a Criminal Trespass.,Open,2025-02-19
2025-0460,02-19-2025 12:00 PM,02-19-2025 7:00 AM,Criminal Mischief,Weinstein Hall,Washington Square,A staff member reported Criminal Mischief.,Open,2025-02-19
2025-0463,02-19-2025 3:37 PM,02-19-2025 12:30 PM,Larceny,Washington Square East at Washington Place,Washington Square,A student reported missing property.,Closed,2025-02-19
00484-2025,2/19/2025 11:14 AM,5/5/2024 12:00:00 AM - 5/5/2024 2:00:00 AM,Rape,Hayden Hall Residence,Washington Square,An individual reported Rape.,Open,2025-02-19
00507-2025,02-20-2025 5:55 PM,02-18-2025 3:50 PM,Criminal Mischief,Third Avenue North Residence Hall,Washington Square,An RA reported Criminal Mischief.,Open,2025-02-20
00504-2025,02-20-2025 3:00 PM,02-18-2025 9:00 AM - 02-18-2025 9:20 AM,Criminal Trespass,Paulson Center,Washington Square,A Campus Safety Officer reported Criminal Trespass.,Closed,2025-02-20
2025-0473,02-20-2025 1:36 PM,01-22-2025 11:00 AM - 02-24-2025 2:00 PM,Sale of Controlled Substance,University Hall,Washington Square,A staff member reported the sale of controlled substance.,Open,2025-02-20
2025-0469,02-20-2025 11:26 AM,02-20-2025 11:31 AM - 02-20-2025 11:44 AM,Disorderly Conduct,Schwartz Hall,Kips Bay,A staff member reported Disorderly Conduct.,Closed/ Referred to NYPD,2025-02-20
2025-0483,02-21-2025 1:53 PM,02-19-2025 12:30 PM - 02-19-2025 1:45 PM,Larceny,1 Washington Place,Washington Square,A student reported missing property.,Open,2025-02-21
00517-2025,02-22-2025 1:49 AM,02-22-2025 12:51 AM - 02-22-2025 1:03 AM,Harassment,Lafayette Hall,Washington Square,A Campus Safety Officer reported Harassment.,Closed/ Referred to NYPD,2025-02-22
00523-2025,02-23-2025 12:15 AM,02-22-2025 11:00 PM,Liquor Law Violation (x15),Gramercy Green Residence Hall,Washington Square,An RA reported Liquor Law Violation.,Closed/ Referred to Office of Student Conduct & Community Standards,2025-02-23
2025-0510,02-24-2025 3:37 PM,02-24-2025 3:20 PM,Traffic Law Violation,Schwartz Hall - Exterior,Kips Bay,A patient reported a hit and run.,Closed/ Referred to NYPD,2025-02-24
2025-0506,02-24-2025 10:34 AM,02-24-2025 10:34 AM - 02-24-2025 10:50 AM,Disorderly Conduct,Schwartz Hall,Kips Bay,A staff member reported Disorderly Conduct.,Open,2025-02-24
2025-0508,02-24-2025 12:55 PM,02-24-2025 11:50 AM - 02-24-2025 12:40 PM,Larceny,Weinstein Hall,Washington Square,A student reported missing property.,Open,2025-02-24
00528-2025,02-24-2025 12:17 PM,02-23-2025 12:10 AM,Dating Violence / Sexual Abuse,Gramercy Green Residence Hall,Washington Square,A staff member reported Sexual Abuse and Dating Violence.,Closed/ Referred to Office of Student Conduct & Community Standards,2025-02-24
2025-0511,02-24-2025 4:30 PM,02-24-2025,Harassment,3 Washington Square Village,Washington Square,A student reported Harassment.,Closed/ Referred to NYPD,2025-02-24
2025-0513,02-24-2025 4:44 PM,02-24-2025 3:00 PM,Harassment,Lilian Vernon Center,Washington Square,A student reported Harassment.,Open,2025-02-24
2025-0507,02-24-2025 12:05 PM,02-24-2025 12:03 PM,Larceny,Vanderbilt Hall - Exterior,Washington Square,A staff member reported Larceny.,Closed/ Referred to NYPD,2025-02-24
00536-2025,02-24-2025 1:44 AM,02-23-2025 10:50 PM,Criminal Mischief,Weinstein Residence Hall,Washington Square,An RA reported defacement of property.,Open,2025-02-24
2025-0521,2/25/2025 2:49 PM,2/16/2025,Criminal Mischief,Paulson Center,Washington Square,A staff member reported Criminal Mischief.,Open,2025-02-25
2025-0523,2/25/2025 17:01,2/25/2025 4:30 PM - 2/25/2025,Larceny - Embezzlement,Washington Square Park,Washington Square,A student reported a Larceny/ Embezzlement. x2,Closed,2025-02-25
2025-0538,02-26-2025 2:40 PM,02-24-2025 - 02-26-2025 10:00 PM,Criminal Mischief,Zurich Hall,Washington Square,A staff member reported damage to property.,Closed/ Referred to NYPD,2025-02-26
2025-0535,02-26-2025 1:32 PM,02-25-2025 11:00 PM,Found Property (reclassified from Larceny),Cantor Film Center,Washington Square,A student reported missing property.,Closed,2025-02-26
2025-0532,02-26-2025 11:05 AM,02-13-2025 - 02-21-2025,Larceny,Paulson Center,Washington Square,A staff member reported missing property.,Open,2025-02-26
2025-0530,02-26-2025 8:00 AM,02-26-2025 7:36 PM,Criminal Mischief,Barney Building,Washington Square,A Campus Safety Officer reported graffiti.,Closed/ Referred to NYPD,2025-02-26
2025-0534,02-26-2025 11:30 AM,02-21-2025 2:22 PM - 02-21-2025 2:30 PM,Larceny,Paulson Center - Exterior,Washington Square,A Non-NYU party reported stolen property.,Open,2025-02-26
2025-0542,02-27-2025 9:01 AM,02-27-2025 9:01 AM - 02-27-2025 11:03 AM,Disorderly Conduct,Schwartz Hall,Kips Bay,A Campus Safety Officer reported Disorderly Conduct.,Closed/ Referred to NYPD,2025-02-27
2025-0565,02-28-2025 5:07 PM,02-28-2025 5:03 PM,Criminal Trespass,Fairchild Building,Washington Square,A Campus Safety Officer reported Criminal Trespass.,Closed,2025-02-28
2025-0559,02-28-2025 2:08 PM,02-28-2025 11:00 AM - 02-28-2025,Larceny,Silver Center,Washington Square,A student reported a Larceny.,Open,2025-02-28
2025-0561,02-28-2025 4:40 PM,02-28-2025 4:38 PM - 02-28-2025 5:00 PM,Criminal Mischief,Gould Plaza,Washington Square,A campus safety officer reported Criminal Mischief.,Closed/ Referred to NYPD,2025-02-28
2025-0578,03-01-2025 11:37 PM,03-01-2025 11:37 PM,Public Lewdness,University Hall,Washington Square,A student reported Public Lewdness.,Closed/ Referred to NYPD,2025-03-01
2025-0572,03-01-2025 5:40 AM,03-01-2025 3:00 AM - 03-01-2025 5:10 AM,Aggravated Assault,Weinstein Hall,Washington Square,A student reported an Aggravated Assault.,Closed/ Referred to NYPD,2025-03-01
2025-0593,03-03-2025 3:55 PM,03-03-2025 3:48 PM,Harassment,2 Metrotech Center - Exterior,Brooklyn Commons,A faculty member reported Harassment.,Open,2025-03-03
2025-0603,03-03-2025 11:41 PM,03-03-2025 9:00 PM - 03-03-2025 10:30 PM,Larceny,Kaufman Management Center,Washington Square,A student reported missing property.,Open,2025-03-03
00654-2025,03-03-2025 10:12 AM,03-03-2025,Larceny,Founders Hall,Washington Square,A student reported missing property.,Open,2025-03-03
2025-0611,03-03-2025 3:12 PM 03-,03-2025 12:00 PM - 03-03-2025 12:05 PM,Harassment,411 Lafayette Street,Washington Square,A staff member reported Harassment.,Closed/ Referre d to NYPD,2025-03-03
2025-0613,03-04-2025 10:08 AM,03-04-2025 10:00 AM,Loitering (27),Bobst Library,Washington Square,A staff member reported Loitering x27.,Open,2025-03-04
2025-0607,03-04-2025 10:40 AM,02-27-2025 5:00 PM - 03-04-2025 10:00 AM,Larceny,Genomics Center,Washington Square,A staff member reported missing property.,Open,2025-03-04
2025-0609,03-04-2025 11:00 AM,02-28-2025 8:00 PM - 03-03-2025 8:45 PM,Larceny,Kimmel Center,Washington Square,A student reported missing property.,Open,2025-03-04
2025-0610,03-04-2025 11:35 AM,03-02-2025 8:30 PM - 03-03-2025 5:00 PM,Larceny,Bobst Library,Washington Square,A student reported missing property.,Open,2025-03-04
2025-0606,03-04-2025 8:55 AM,03-04-2025 8:55 AM,Criminal Mischief,133 MacDougal Street,Washington Square,A Campus Safety Officer reported graffiti.,Closed/ Referre d to NYPD,2025-03-04
00689-2025,03/05/2025 3:30 PM,01/29/2025 12:00 PM - 03/03/2025 12:00 PM,"Stalking, Menacing, Harassment (x2)",Weinstein Hall,Washington Square,"A student reported stalking, menacing, and two incidents of harassment.",Closed/Referred to Title IX,2025-03-05
2025-0631,03/05/2025 5:24 PM,03/05/2025 1:30 PM - 03/05/2025 4:59 PM,Larceny,Paulson Center,Washington Square,A student reported a Larceny.,Open,2025-03-05
2025-0629,03/05/2025 4:00 PM,02/10/2025 4:00 PM,Larceny,Schwartz Hall,Kips Bay,A student reported a larceny.,Open,2025-03-05
2025-0630,03/05/2025 4:30 PM,03/05/2025 4:20 PM,Criminal Trespass,35 W 4th Street,Washington Square,A Campus Safety Officer reported a PNG individual entered the lobby but was denied further access to the building.,Open,2025-03-05
2025-0631,03/05/2025 5:24 PM,03/05/2025 5:03 PM,Criminal Trespass,Weinstein Hall,Washington Square,A Campus Safety Officer reported a criminal trespass.,Open,2025-03-05
00689-2025,03/05/2025 3:30 PM,01/29/2025 - 03/03/2025,"Stalking, Menacing, Harassment (x2)",Weinstein Hall,Washington Square,"A student reported stalking, menacing, and two incidents of harassment.",Closed/ Referred to Title IX,2025-03-05
2025-0630,03/05/2025 4:30 PM,03/05/2025 4:20 PM,Criminal Trespass,35 W 4th Street,Washington Square,A Campus Safety Officer reported a PNG individual entered the lobby but was denied further access to the building.,Open,2025-03-05
2025-0622,03/05/2025 11:46 AM,03/04/2025 5:00 PM - 03/05/2025 11:00 AM,Larceny,Third North,Washington Square,A student reported a larceny.,Open,2025-03-05
2025-0641,03/06/2025 1:32 PM,03/06/2025 7:28 AM,Harassment,East Building,Washington Square,A Campus Safety Officer reported Harassment.,Open,2025-03-06
2025-0637,03/06/2025 10:05 AM,03/06/2025 10:05 AM - 03/06/2025 10:30 AM,Disorderly Conduct,Schwartz Hall,Kips Bay,A staff member reported Disorderly Conduct.,Open,2025-03-06
2025-0642,03/06/2025 3:25 PM,03/05/2025 2:00 PM - 03/05/2025 3:28 PM,Larceny,Bobst Library,Washington Square,A student reported missing property.,Closed/ Referred to NYPD,2025-03-06
2025-0633,03/06/2025 2:18 AM,03/06/2025 2:15 AM,Criminal Mischief,726 Broadway (Exterior),Washington Square,A Campus Safety Officer reported vandalism.,Closed/Referred to NYPD,2025-03-06
2025-0646,03/06/2025 7:30 PM,03/06/2025 7:05 PM - 03/06/2025 7:11 PM,Disorderly Conduct,Skirball Center,Washington Square,A staff member reported Disorderly Conduct.,Open,2025-03-06
2025-0649,03/07/2025 2:45 AM,03/07/2025 1:00 AM - 03/07/2025 2:30 AM,"Aggravated Assault, Dating Violence, Stalking, Harassment",Founders Hall,Washington Square,"A student reported dating violence involving Aggravated Assault, Stalking, and Harassment.",Closed/ Referred to Title IX,2025-03-07
2025-0659,03/08/2025 2:40 AM,03/08/2025 2:36 AM - 03/08/2025 2:40 AM,Criminal Trespass/ Harassment,Broome Street Residence Hall,Washington Square,A campus safety officer reported a Criminal Trespass/ Harassment.,Closed/ Referred to NYPD,2025-03-08
2025-0667,03/08/2025 2:11 PM,03/08/2025 2:11 PM - 03/08/2025 3:01 PM,Criminal Trespass,725 Broadway,Washington Square,A campus safety officer reported a Criminal Trespass.,Closed/ Referred to NYPD,2025-03-08
2025-0668,03/08/2025 5:39 PM,03/08/2025 5:26 PM - 03/08/2025 12:00 AM,Criminal Trespass,404 Lafayette Street,Washington Square,A campus safety officer reported a Criminal Trespass.,Open,2025-03-08
2025-0671,03/08/2025 8:41 PM,03/08/2025 6:10 PM - 03/08/2025 7:50 PM,Larceny/ Embezzlement,Lipton Residence Hall - Exterior,Washington Square,A student reported Larceny/ Embezzlement.,Closed/ Referred to NYPD,2025-03-08
2025-0676,03/09/2025 10:37 AM,03/09/2025 10:28 AM - 03/09/2025 11:45 AM,Larceny,Vanderbilt Hall - Exterior,Washington Square,A campus safety officer reported a Larceny.,Closed/ Referred to NYPD,2025-03-09
2025-0677,03/09/2025 3:45 PM,03/08/2025 11:55 AM - 03/08/2025 4:45 PM,Larceny,404 Lafayette Street,Washington Square,A student reported a Larceny.,Open,2025-03-09
2025-0693,03/10/2025 7:30 PM,03/10/2025 5:23 PM - 03/10/2025 7:04 PM,Harassment,Broome Street Residence,Washington Square,A student reported Harassment.,Open,2025-03-10
2025-0689,03/10/2025 6:00 PM,03/10/2025 4:16 PM - 03/10/2025 5:30 PM,Larceny,404 Lafayette Street,Washington Square,A student reported a Larceny.,Open,2025-03-10
2025-0690,03/10/2025 7:33 PM,03/10/2025 5:30 PM - 03-10-2025,Harassment,Bobst Library,Washington Square,A student reported Harassment.,Open,2025-03-10
2025-0687,03/10/2025 5:08 PM,03-06-2025- 03-07-2025,Harassment,Palladium Residence Hall,Washington Square,A staff member reported Harassment.,Open,2025-03-10
2025-0688,03/10/2025 4:30 PM,03/10/2025 2:00 PM - 03/10/2025 3:00 PM,Larceny,Washington Place & Greene Street,Washington Square,A student reported missing property.,Open,2025-03-10
2025-0685,03/10/2025 3:54 PM,03/10/2025 1:30 PM - 03/10/2025 2:45 PM,Larceny,Palladium Residence Hall,Washington Square,A student reported a Larceny.,Open,2025-03-10
2025-0698,03/11/2025 10:29 AM,03/07/2025 2:00 PM - 03/07/2025 7:00 PM,Larceny,708 Broadway,Washington Square,A staff member reported a Larceny.,Open,2025-03-11
2025-0700,03/11/2025 11:39 AM,03/11/2025 11:21 AM - 03/11/2025 1:10 PM,Disorderly Conduct,Schwartz Hall,Kips Bay,A staff member reported Disorderly Conduct.,Open,2025-03-11
2025-0702,03/11/2025 3:24 PM,03/05/2025 12:00 AM - 03/05/2025 12:00 AM,Harassment,Founders Residence Hall,Washington Square,A student reported Harassment.,Open,2025-03-11
2025-0703,03/11/2025 4:03 PM,03/11/2025 3:20 PM - 03/11/2025 3:20 PM,Criminal Mischief,Silver Center,Washington Square,A campus safety officer reported Criminal Mischief.,Open,2025-03-11
2025-0706,03/11/2025 6:50 PM,03-11-2025 - 03/11/2025 6:20 PM,Larceny,Tisch Hall,Washington Square,A student reported a Larceny.,Open,2025-03-11
2025-0709,03/11/2025 10:20 PM,03/11/2025 7:00 PM - 03/11/2025 8:30 PM,Larceny,Lipton Residence Hall,Washington Square,A student reported a Larceny.,Open,2025-03-11
2025-0701,03/11/2025 11:41 AM,03/11/2025 11:30 AM - 03/11/2025 11:50 AM,Disorderly Conduct,383 Lafayette Street,Washington Square,A campus safety officer reported Disorderly Conduct.,Closed/ Referred to NYPD,2025-03-11
2025-0717,03/12/2025 4:52 PM,02/14/2025 6:21 PM - 02-14-2025,Harassment,Alumni Residence Hall,Washington Square,A staff member reported Harassment.,Closed,2025-03-12
2025-0720,03/12/2025 5:50 PM,03/11/2025 9:00 PM - 03/12/2025 12:00 AM,Larceny,Silver Center,Washington Square,A student reported a Larceny.,Closed/ Referred to NYPD,2025-03-12
2025-0721,03/12/2025 7:35 PM,03/12/2025 7:25 PM - 03/12/2025 7:50 PM,Criminal Trespass,Lipton Residence Hall,Washington Square,A campus safety officer reported a Criminal Trespass,Open,2025-03-12
2025-0722,03/12/2025 8:11 PM,03/12/2025 8:00 PM - 03/12/2025 8:05 PM,Larceny,Washington Square Park,Washington Square,A student reported missing property.,Closed/ Referred to NYPD,2025-03-12
2025-0725,03/13/2025 6:09 AM,03/13/2025 6:00 AM - 03-13-2025,Menacing/ Intimidation,Washington Square Park,Washington Square,A student reported Menacing/ Intimidation.,Open,2025-03-13
2025-0737,03/13/2025 8:44 PM,03/13/2025 6:15 PM - 03/13/2025 8:30 PM,Larceny,Rogers Hall,Brooklyn Commons,A student reported a Larceny.,Closed,2025-03-13
2025-0735,03/13/2025 3:16 PM,03/13/2025 3:16 PM - 03/13/2025 3:30 PM,Criminal Mischief,Carlyle Court - Exterior,Washington Square,A campus safety officer reported Criminal Mischief.,Open,2025-03-13
2025-0728,03/13/2025 8:11 AM,03-13-2025 Unknown - 03-13-2025,Criminal Trespass,Weinstein Residence Hall,Washington Square,A staff member reported a Criminal Trespass.,Open,2025-03-13
2025-0729,03/13/2025 11:43 AM,03/13/2025 9:26 AM - 03/13/2025 9:27 AM,Larceny,NYU Bookstore,Washington Square,A staff member reported a Larceny.,Closed/ Referred to NYPD,2025-03-13
2025-0749,03/14/2025 7:55 PM,03/14/2025 5:40 PM - 03-14-2025,Larceny/ Embezzlement,Washington Square Park,Washington Square,A student reported Larceny/ Embezzlement.,Closed,2025-03-14
2025-0744,03/14/2025 12:19 PM,03/13/2025 4:00 PM - 03-14-2025,Larceny,Hayden Residence Hal,Washington Square,A student reported a Larceny.,Open,2025-03-14
2025-0759,03/15/2025 3:33 PM,03/15/2025 9:30 AM - 03/15/2025 3:20 PM,Motor Vehicle Theft,725 Broadway - Exterior,Washington Square,A student reported an Electric Scooter Theft.,Closed,2025-03-15
2025-0765,03/17/2025 3:58 AM,03/17/2025 12:35 AM - 03/17/2025 3:40 AM,Larceny,Palladium Residence Hall,Washington Square,A student reported a Larceny.,Closed,2025-03-17
2025-0771,03/17/2025 3:40 PM,03/07/2025 1:20 PM - 03/07/2025 3:40 PM,Larceny,Schwartz Hall,Kips Bay,A student reported a Larceny.,Closed/ Referred to NYPD,2025-03-17
2025-0790,03/18/2025 5:51 PM,03/17/2025 5:00 PM - 03/17/2025 10:00 PM,Larceny,Bobst Library,Washington Square,A student reported a Larceny.,Open,2025-03-18
2025-0779,03/18/2025 3:14 AM,03/17/2025 2:30 PM - 03/18/2025 3:15 AM,Motor Vehicle Theft,Dibner Library - Exterior,Brooklyn Commons,A student reported a E-Scooter Theft.,Closed/ Referred to NYPD,2025-03-18
2025-0794,03/18/2025 9:25 PM,03/18/2025 9:22 PM - 03/18/2025 9:35 PM,Criminal Trespass,370 Jay Street,Brooklyn Commons,A campus safety officer reported a Criminal Trespass.,Closed/ Referred to NYPD,2025-03-18
2025-0793,03/18/2025 7:03 PM,03/18/2025 2:00 PM - 03/18/2025 6:00 PM,Motor Vehicle Theft,Schwartz Hall - Exterior,Kips Bay & Langone (Public property only),A student reported a stolen electric scooter.,Open,2025-03-18
2025-0788,03/18/2025 2:47 PM,03/03/2025 2:38 PM - 03/03/2025 2:42 PM,Disorderly Conduct,NYU Bookstore,Washington Square,A staff member reported Disorderly Conduct.,Open,2025-03-18
2025-0800,03/19/2025 11:58 AM,03/14/2025 4:00 PM - 03/18/2025 6:30 PM,Larceny,King Juan Carlos,Washington Square,A student reported a Larceny.,Closed,2025-03-19
00881-2025,03/19/2025 1:30 PM,09-01-2024 - 10-02-2024,Stalking/ Sexual Abuse/ Fondling,370 Jay Street,Brooklyn Commons,A student reported Stalking/ Sexual Abuse/ Fondling x3.,Closed/ Referred to Office of Student Conduct & Community Standards,2025-03-19
00883-2025,03/19/2025 1:43 PM,09/27/2024 4:00 PM - 10-06-2024 Unknown,Stalking/ Fondling/ Sexual Abuse,370 Jay Street,Brooklyn Commons,A student reported Stalking/ Fondling x2/ Sexual Abuse.,Closed/ Referred to Office of Student Conduct & Community Standards,2025-03-19
2025-0798,03/19/2025 11:36 AM,03/19/2025 10:00 AM - 03/19/2025 11:45 AM,Larceny,404 Lafayette Street,Washington Square,A student reported a Larceny.,Closed,2025-03-19
00905-2025,03/20/2025 12:41 PM,03/18/2025 11:30 PM - 03/19/2025 12:50 AM,Larceny,Coral Towers Residence Hall,Washington Square,A student reported a Larceny.,Closed/ Referred to Office of Student Conduct & Community Standards,2025-03-20
2025-0811,03/20/2025 8:08 AM,03/20/2025 8:00 AM - 03-20-2025,Larceny,Washington Square South & Washington Square West Intersection,Washington Square,A student reported a Larceny.,Closed/ Referred to NYPD,2025-03-20
2025-0809,03/20/2025 12:38 AM,03/08/2025 1:00 PM - 03-17-2025,Stalking,Palladium Residence Hall,Washington Square,A student reported Stalking.,Closed,2025-03-20
2025-0818,03/20/2025 4:27 PM,03-20-2025 - 03-20-2025,Simple Assault,Schwartz Hall - Exterior,Kips Bay & Langone (Public property only),A student reported Simple Assault.,Closed/ Referred to NYPD,2025-03-20
00928-2025,03-21-2025 2:42 PM,03-17-2025 4:19 PM,Larceny,Carlyle Court Residence Hall,Washington Square,A student reported missing property.,Closed/ Referred to Office of Student Conduct & Community Standards,2025-03-21
2025-0843,03-22-2025 9:53 AM,03-22-2025 9:53 AM - 03-22-2025 12:46 PM,Criminal Tampering,Undisclosed on-campus location,,A staff member reported a hacking.,Closed/ Referred to NYPD,2025-03-22
2025-0852,03-23-2025 3:54 PM,03-23-2025 3:40 PM,Criminal Trespass,Bobst Library,Washington Square,A Campus Safety Officer reported Criminal Trespass.,Closed,2025-03-23
2025-0866,03-24-2025 4:35 PM,03-24-2025 4:35 PM,Criminal Mischief,Othmer Residence Hall,Brooklyn Commons,A Campus Safety Officer reported graffiti.,Closed/ Referred to NYPD,2025-03-24
2025-0876,03-25-2025,03-25-2025 4:30 PM - 03-25-2025 5:00 PM,Larceny,Palladium Residence Hall,Washington Square,A student reported stolen property.,Closed/ Referred to NYPD,2025-03-25
2025-0877,03-25-2025 5:50 PM,03-25-2025,Harassment,Washington Square Park,Washington Square,A student reported Harassment.,Closed/ Referred to NYPD,2025-03-25
2025-0884,03-26-2025 7:48 PM,03-26-2025,Criminal Mischief,238 Thompson Street,Washington Square,An NYU-affiliate reported Criminal Mischief.,Open,2025-03-26
2025-0885,03-27-2025 12:16 PM,03-27-2025 12:16 PM,Falsely Reporting an Incident,Tisch Hall,Washington Square,An individual falsely activated a fire alarm.,Closed/ Referred to NYPD,2025-03-27
00989-2025,03-27-2025 6:31 PM,03-27-2025 2:50 PM,Liquor Law Violation (x4),Greenwich Residence Hall,Washington Square,A staff member reported underage alcohol possession.,Closed/ Referred to Office of Student Conduct & Community Standards,2025-03-27
2025-0899,03-28-2025 10:32 PM,03-28-2025 10:20 PM,Harassment,Brittany Hall,Washington Square,A student reported Harassment.,Open,2025-03-28
2025-0904,03-29-2025 2:52 AM,03-29-2025 2:52 AM,Criminal Mischief,10 Washington Place,Washington Square,A Campus Safety Officer reported graffiti.,Closed/ Referred to NYPD,2025-03-29
2025-0905,03-29-2025 6:03 PM,03-29-2025 5:00 PM - 03-29-2025 5:05 PM,Harassment,Washington Square Park,Washington Square,A student reported Harassment.,Open,2025-03-29
2025-0913,03-30-2025 10:52 PM,12-2024 - 03-30-2025,Larceny,7 Washington Place,Washington Square,A Campus Safety Officer reported missing property.,Open,2025-03-30
2025-0911,03-30-2025 6:48 PM,03-30-2025 6:15 PM - 03-30-2025 6:45 PM,Larceny,Gramercy Green,Washington Square,A student reported stolen property.,Open,2025-03-30
2025-0908,03-30-2025 7:22 AM,03-30-2025 7:22 AM,Criminal Mischief,Kimmel Center,Washington Square,A Campus Safety Officer reported graffiti.,Open,2025-03-30
2025-0916,03-31-2025 2:11 AM,03-31-2025 2:11 AM,Criminal Mischief,Gould Plaza,Washington Square,A staff member reported graffiti.,Closed/ Referred to NYPD,2025-03-31
2025-0920,03-31-2025 10:45 AM,03-02-2025 10:53 AM - 03-04-2025 9:00 AM,Larceny,Hayden Hall,Washington Square,A student reported missing property.,Open,2025-03-31
2025-0930,04-01-2025 7:48 AM,03-07-2025 4:10 PM - 03-07-2025 4:20 PM,Criminal Trespass,Kimmel Center,Washington Square,A staff member reported a Criminal Trespass.,Open,2025-04-01
2025-0956,04-02-2025 9:37 PM,04-02-2025 8:13 PM - 04-02-2025 8:15 PM,Larceny,2 Metrotech Center,Brooklyn Commons,A student reported stolen property.,Open,2025-04-02
2025-0962,04-03-2025 12:45 PM,04-03-2025 12:20 PM - 04-03-2025 12:30 PM,Larceny,238 Thompson Street,Washington Square,A student reported missing property.,Closed/ Referred to NYPD,2025-04-03
2025-0966,04-03-2025 4:20 PM,04-01-2025 9:00 PM,Larceny,Washington Square Park,Washington Square,A student reported stolen property.,Closed/ Referred to NYPD,2025-04-03
2025-0969,04-03-2025 5:38 PM,04-03-2025,Hate Crime / Criminal Mischief,Bobst Library,Washington Square,A student reported vandalism motivated by bias.,Closed/ Referred to NYPD,2025-04-03
2025-0981,04/04/2025 11:27 AM,04/04/2025 11:23 AM - 04/04/2025 12:01 PM,Criminal Mischief,Kevorkian Center - Exterior,Washington Square,A campus safety officer reported Criminal Mischief.,Closed/ Referred to NYPD,2025-04-04
2025-0979,04-04-2025 10:55 AM,04-04-2025 9:10 AM - 04-04-2025 10:50 AM,Larceny,Mercer Street and Bleecker Street,Washington Square,A student reported missing property.,Closed,2025-04-04
01042-2025,04-04-2025 2:00 AM,04-04-2025 12:43 AM,Gambling,University Residence Hall,Washington Square,An RA reported Gambling.,Closed/ Referred to Office of Student Conduct & Community Standards,2025-04-04
2025-1000,04/06/2025 5:34 PM,04/06/2025 5:00 PM - 04/06/2025 6:00 PM,Harassment,Bobst Library,Washington Square,A student reported Harassment.,Open,2025-04-06
2025-1009,04/07/2025 3:19 PM,04/07/2025 2:00 PM - 04/07/2025 3:14 PM,Aggravated Assault,Schwartz Hall,Kips Bay,A staff member reported an Aggravated Assault.,Closed/ Referred to NYPD,2025-04-07
2025-1023,04/08/2025 5:25 PM,04/08/2025 1:30 PM - 04-08-2025,Harassment,Silver Center - Exterior,Washington Square,A staff member reported Harassment.,Closed,2025-04-08
2025-1015,04/08/2025 4:02 AM,04/08/2025 4:02 AM - 04-08-2025,Criminal Mischief,Meyer Hall,Washington Square,A staff member reported Criminal Mischief.,Open,2025-04-08
2025-1042,04/09/2025 1:10 PM,04/08/2025 10:00 AM - 04/08/2025 1:00 PM,Larceny,Schwartz Hall,Kips Bay,A student reported a Larceny.,Open,2025-04-09
2025-1031,04/09/2025 8:01 AM,04/09/2025 8:01 AM - 04/09/2025 8:09 AM,Harassment/ Criminal Mischief,Starbucks - 45 West 4th Street,Washington Square,A staff member reported Harassment/ Criminal Mischief.,Closed/ Referred to NYPD,2025-04-09
2025-1037,04/09/2025 10:00 AM,04/09/2025 9:33 AM - 04/09/2025 9:42 AM,Disorderly Conduct,Schwartz Hall,Kips Bay,A staff member reported Disorderly Conduct.,Open,2025-04-09
2025-1038,04/09/2025 8:52 AM,04/09/2025 8:00 AM - 04/09/2025 8:30 AM,Criminal Mischief,370 Jay Street - Exterior,Brooklyn Commons,A campus safety officer reported Criminal Mischief.,Closed/ Referred to NYPD,2025-04-09
2025-1053,04/10/2025 4:46 PM,04/10/2025 2:00 PM - 04/10/2025 4:00 PM,Larceny,15 Washington Place,Washington Square,A staff member reported a Larceny.,Open,2025-04-10
2025-1054,04/10/2025 5:51 PM,04/10/2025 5:50 PM - 04/10/2025 5:51 PM,Larceny,Founders Residence Hall,Washington Square,A student reported a Larceny.,Closed,2025-04-10
2025-1050,04/10/2025 1:33 PM,04/10/2025 12:50 PM - 04-10-2025,Harassment,721 Broadway - Exterior,Washington Square,A student reported Harassment.,Open,2025-04-10
2025-1060,04/11/2025 12:56 PM,04/11/2025 11:45 AM - 04-11-2025,Harassment,LaGuardia Place & West 3rd Street,Washington Square,A student reported Harassment.,Closed,2025-04-11
2025-1061,04/12/2025 3:35 AM,04/12/2025 3:31 AM - 04/12/2025 4:33 AM,Criminal Mischief,721 Broadway - Exterior,Washington Square,A staff member reported Criminal Mischief.,Open,2025-04-12
2025-1062,04/12/2025 5:36 AM,04/12/2025 5:36 AM - 04/12/2025 5:52 AM,Falsely Reporting an Incident,Carlyle Court Residence Hall,Washington Square,A staff member reported Falsely Reporting an Incident.,Closed,2025-04-12
2025-1065,04/12/2025 1:03 PM,04-11-2025 - 04-11-2025,Harassment,Broome Street Residence Hall,Washington Square,A student reported Harassment.,Closed/ Referred to Office of Student Conduct & Community Standards,2025-04-12
2025-1070,04/12/2025 11:57 PM,03/12/2025 6:30 PM - 03/12/2025 11:35 PM,Larceny,Lipton Residence Hall,Washington Square,A student reported a Larceny.,Closed,2025-04-12
2025-1090,04/14/2025 4:43 PM,11-01-2024 - 04/14/2025 4:35 PM,Dating Violence/ Stalking/ Harassment,Furman Hall - Exterior,Washington Square,A student reported Dating Violence/ Stalking/ Harassment.,Closed/ Referred to NYPD,2025-04-14
2025- 1101,04/15/2025 1:32 PM,02-19-2025 - 04/11/2025 7:30 AM,Larceny,Schwartz Hall,Kips Bay,A student reported a Larceny.,Open,2025-04-15
2025-1103,04/15/2025 2:30 PM,04/09/2025 8:00 PM - 04/15/2025 8:30 AM,Larceny,Schwartz Hall,Kips Bay,A student reported a Larceny.,Closed,2025-04-15
2025-1093,04/15/2025 2:17 AM,04/15/2025 1:51 AM - 04/15/2025 3:04 AM,Harassment,University Hall,Washington Square,A campus safety officer reported Harassment.,Closed/ Referred to NYPD,2025-04-15
2025-1105,04/15/2025 6:23 PM,04/15/2025 5:00 PM - 04/15/2025 6:00 PM,Larceny,Lipton Residence Hall,Washington Square,A student reported a Larceny.,Closed,2025-04-15
2025-1109,04/15/2025 11:11 PM,04/15/2025 11:02 PM - 04/15/2025 11:31 PM,Harassment,Pless Hall,Washington Square,A campus safety officer reported Harassment.,Closed,2025-04-15
2025-1100,04/15/2025 11:12 AM,04/15/2025 10:55 AM - 04-15-2025,Criminal Trespass,Schwartz Plaza,Washington Square,A staff member reported a Criminal Trespass.,Open,2025-04-15
2025-1122,04/16/2025 10:35 PM,04/16/2025 10:10 PM - 04/16/2025 10:25 PM,Larceny,Bobst Library,Washington Square,A student reported a Larceny.,Open,2025-04-16
2025- 1116,04/16/2025 12:35 PM,04/16/2025 11:30 AM - 04/16/2025 11:45 AM,Disorderly Conduct,Schwartz Hall,Kips Bay,A student reported Disorderly Conduct.,Open,2025-04-16
2025- 1131,04/17/2025 4:25 PM,04/17/2025 3:10 PM - 04/17/2025 4:10 PM,Motor Vehicle Theft,Kimmel Center - Exterior,Washington Square,A staff member reported an e-scooter theft.,Closed/ Referred to NYPD,2025-04-17
2025-1137,04-18-2025 10:15 AM,04-17-2025,Harassment,715 Broadway,Washington Square,A staff member reported Harassment.,Closed,2025-04-18
2025-1132,04/18/2025 10:48 PM,04/16/2025 11:00 PM - 04/18/2025 8:30 PM,Larceny,University Hall,Washington Square,A student reported a Larceny.,Open,2025-04-18
2025-1142,04-18-2025 2:21 PM,04-18-2025 1:22 PM - 04-18-2025 2:21 PM,Criminal Trespass,Kimmel Hall,Washington Square,A student reported Criminal Trespass.,Closed/ Referred to NYPD,2025-04-18
2025-1143,04-18-2025 4:50 PM,04-18-2025 4:50 PM,Criminal Mischief,Silver Center,Washington Square,A Campus Safety Officer reported graffiti.,Closed/ Referred to NYPD,2025-04-18
2025-1141,04-18-2025 12:43 PM,04-18-2025,Harassment,Alumni Hall,Washington Square,A student reported Harassment.,Closed/ Referred to NYPD,2025-04-18
2025-1158,04-20-2025 9:51 AM,03-28-2025 11:00 PM 04-20-2025 8:00 am,Larceny,Palladium Hall,Washington Square,A student reported missing property.,Open,2025-04-20
2025-1159,04-20-2025 12:12 PM,04-20-2025 12:12 PM,Harassment,Bobst Library - Exterior,Washington Square,A Security Officer reported Harassment.,Closed/ Referred to NYPD,2025-04-20
2025-1161,04-20-2025 4:00 PM,04-19-2025 2:49 PM - 04-19-2025 10:03 PM,Larceny,Hayden Hall,Washington Square,A student reported missing property.,Open,2025-04-20
2025-1162,04-20-2025 3:54 PM,04-20-2025 2:22 PM - 04-20-2025 3:12 PM,Larceny,Paulson Center,Washington Square,A student reported missing property.,Open,2025-04-20
2025-1175,04-21-2025 12:47 PM,04-21-2025 12:47 PM - 04-21-2025 1:30 PM,Loitering,Forbes Building,Washington Square,A Campus Safety Officer reported Loitering.,Closed/ Referred to NYPD,2025-04-21
01219-2025,04-21-2025 10:38 AM,04-19-2025 - 04-21-2025,Criminal Mischief,Greenwich Hall,Washington Square,A student reported property damages.,Open,2025-04-21
2025-1181,04-21-2025 8:32 PM,04-21-2025,Stalking,400 Broome Street,Washington Square,A student reported Stalking.,Closed/ Referred to Office of Student Conduct & Community Standards,2025-04-21
2025-1198,04-22-2025 11:30 PM,04-22-2025 3:30 PM - 04-22-2025 8:40 PM,Larceny,Shimkin Hall,Washington Square,A student reported missing property.,Open,2025-04-22
2025-1194,04-22-2025 6:55 PM,04-22-2025 6:00 PM,Criminal Mischief,715 Broadway - Exterior,Washington Square,A staff member reported property damage.,Open,2025-04-22
2025-1188,04-22-2025 11:58 AM,04-20-2025 12:00 PM 04-21-2025 10:00 AM,Larceny,Seventh Street Residence Hall,Washington Square,A student reported missing property.,Open,2025-04-22
2025-1184,04-22-2025 5:20 AM,04-22-2025 5:20 AM,Criminal Mischief,12 Waverly Place,Washington Square,A Campus Safety Officer reported property damage.,Closed/ Referred to NYPD,2025-04-22
2025-1187,04-22-2025 12:51 PM,03-01-2025 - 04-01-2025,Harassment,Paulson Center,Washington Square,A staff member reported Harassment.,Open,2025-04-22
2025-1182,04-22-2025 1:25 AM,04-18-2025 12:00 PM 4-18-2025 3:30 PM,Larceny,6th Street Residence Hall,Washington Square,A student reported missing property.,Open,2025-04-22
2025-1202,04-23-2025 11:51 AM,04-23-2025 11:50 AM - 04-23-2025 11:58 AM,Harassment,Kimball Hall - Exterior,Washington Square,A Campus Safety Officer reported Harassment.,Closed/ Referred to NYPD,2025-04-23
2025-1204,04-23-2025 12:40 PM,04-23-2025 12:40 PM - 04-23-2025 1:14 PM,Loitering,Weissman Hall,Kips Bay,A staff member reported Loitering.,Closed/ Referred to NYPD,2025-04-23
2025-1207,04-23-2025 4:40 PM,04-23-2025 7:30 AM - 04-23-2025 4:30 PM,Motor Vehicle Theft,4 Washington Place - Exterior,Washington Square,A student reported a stolen e-scooter.,Closed/ Referred to NYPD,2025-04-23
01263-2025,04-24-2025 9:45 AM,03-15-2025 - 04-24-2025,Harassment,Carlyle Court Residence Hall,Washington Square,A student reported Harassment.,Closed/ Referred to Title IX,2025-04-24
2025-1223,04-24-2025 7:40 PM,04-24-2025 6:16 PM - 04-24-2025 7:40 PM,Loitering,561 LaGuardia Place,Washington Square,A Campus Safety Officer reported Loitering.,Open,2025-04-24
2025-1223,04-24-2025 6:16 PM,04-21-2025 - 04-24-2025,Stalking,721 Broadway,Washington Square,A student reported Stalking.,Closed/ Referred to Title IX,2025-04-24
2025-1213,04-24-2025 11:40 AM,04-23-2025 11:30 PM - 04-23-2025 11:45 PM,Larceny,Grammercy Green Residence Hall,Washington Square,A student reported missing property.,Open,2025-04-24
2025-1211,04-24-2025 1:30 AM,04-23-2025 10:51 PM - 04-23-2025 11:25 PM,Criminal Mischief,Gould Plaza,Washington Square,A Campus Safety Officer reported graffiti.,Closed/ Referred to NYPD,2025-04-24
2025-1218,04-24-2025 3:47 PM,04-24-2025 3:30 PM - 04-24-2025 3:40 PM,Larceny,Sixth Street Residence Hall,Washington Square,A student reported missing property.,Closed/ Referred to NYPD,2025-04-24
2025-1210,04-24-2025 1:19 AM,04-24-2025 1:17 AM,Harassment,Palladium Hall - Exterior,Washington Square,A student reported Harassment.,Open,2025-04-24
2025-1221,04-24-2025 7:24 PM,02-04-2025 4:00 PM - 04-17-2025,Harassment,Third North Hall,Washington Square,A student reported Harassment.,Open,2025-04-24
2025-1238,04-25-2025 7:14 PM,04-25-2025 1:00 PM - 04-25-2025 7:11 PM,Larceny,725 Broadway - Exterior,Washington Square,A student reported missing property.,Open,2025-04-25
2025-1241,04-25-2025 9:35 PM,04-25-2025 7:50 PM - 04-25-2025 9:25 PM,Larceny,Second Street Residence Hall,Washington Square,A student reported missing property.,Open,2025-04-25
2025-1239,04-25-2025 6:24 PM,04-25-2025 4:15 PM - 04-25-2025 6:24 PM,Larceny,404 Lafayette Street,Washington Square,A student reported missing property.,Closed/ Referred to NYPD,2025-04-25
2025-1236,04-25-2025 4:55 PM,04-25-2025 2:00 PM - 04-25-2025 3:55 PM,Larceny,370 Jay Street - Exterior,Brooklyn Commons,A student reported missing property.,Closed,2025-04-25
2025-1234,04-25-2025 4:50 PM,04-25-2025 4:50 PM - 04-25-2025 5:20 PM,Harassment,Washington Mews,Washington Square,A student reported Harassment.,Closed/ Referred to NYPD,2025-04-25
2025-1228,04-25-2025 7:35 AM,04-05-2025,Larceny,Schwartz Hall,Kips Bay,A staff member reported missing property.,Open,2025-04-25
2025-1227,04-25-2025 2:37 AM,04-25-2025 2:20 AM,Public Lewdness,Third North Hall,Washington Square,A student reported Public Lewdness.,Open,2025-04-25
2025-1235,04-25-2025 3:00 PM,04-25-2025 2:00 PM - 04-25-2025 3:00 PM,Larceny,Paulson Center,Washington Square,A student reported missing property.,Closed/ Referred to NYPD,2025-04-25
2025-1248,04-26-2025 10:55 AM,04-26-2025 10:55 AM,Criminal Mischief,Lillian Vernon Creative Writers House - Exterior,Washington Square,A Campus Safety Officer reported graffiti.,Closed/ Referred to NYPD,2025-04-26
2025-1243,04-26-2025 1:15 PM,04-26-2025,Criminal Mischief,Forbes Building - Exterior,Washington Square,A Campus Safety Officer reported graffiti.,Closed/ Referred to NYPD,2025-04-26
2025-1250,04-26-2025 8:40 PM,04-26-2025 7:30 PM - 04-26-2025 7:40 PM,Larceny,Washington Square Park,Washington Square,A student reported missing property.,Open,2025-04-26
2025-1247,04-26-2025 6:21 AM,04-26-2025 6:21 AM,Larceny,Gramercy Green Residence Hall,Washington Square,A Campus Safety Officer reported stolen property.,Closed/ Referred to NYPD,2025-04-26
2025-1244,04-26-2025 2:05 PM,04-26-2025 2:05 PM - 04-26-2025 2:06 PM,Harassment,Founders Hall,Washington Square,A Campus Safety Officer reported Harassment.,Open,2025-04-26
2025-1255,04-27-2025 5:01 AM,04-27-2025 5:05 AM,Criminal Mischief,Kevorkian Center - Exterior,Washington Square,A Campus Safety Officer reported graffiti.,Closed/ Referred to NYPD,2025-04-27
2025-1275,04-28-2025 5:34 PM,04-28-2025 3:15 PM,Larceny,Washington Square Park,Washington Square,A student reported stolen property.,Closed/ Referred to NYPD,2025-04-28
2025-1272,04-28-2025 2:45 PM,04-28-2025 2:20 PM - 04-28-2025 2:55 PM,Criminal Trespass,Dibner Library,Brooklyn Commons,A student reported Criminal Trespass.,Open,2025-04-28
2025-1268,04-28-2025 12:21 PM,04-28-2025 11:00 AM - 04-28-2025 2:00 PM,Larceny,404 Lafayette Street,Washington Square,A student reported missing property.,Closed/ Referred to NYPD,2025-04-28
